484,484,Adolfo Prieto,,Benito Ju+//0A7f/9AOc-rez,,+ACI-http://maps.google.com/maps?q+AD0-loc:19.386896,-99.1687511+ACI-,,,,,,,,,1028,,,,,,Cuauht+//0A7f/9AKk-moc y Diaz miron,,Casa,Muchas grietas severas,,,,19.386896,-99.1687511,
485,485,Valencia,,Benito Ju+//0A7f/9AOc-rez,,+ACI-http://maps.google.com/maps?q+AD0-loc:19.3729355,-99.1807184+ACI-,,,,,,,,,43,,,,,,Cuauht+//0A7f/9AKk-moc y Golondrinas,,Casa,+ACI-Grietas por todo el edificio y dentro de los departamentos en varias paredes, desconocemos si hay da+//0A7f/9ALE-o estructural. Por favor que alguien venga a revisar. Much+//0A7QBf-simas gracias+ACEAIQAh-+ACI-,,,,19.3729355,-99.1807184,
486,486,Malintzin,,Benito Ju+//0A7f/9AOc-rez,,+ACI-http://maps.google.com/maps?q+AD0-loc:19.3656674,-99.1387516+ACI-,,,,,,,,,15,,,,,,Del Parque y Miami,,Departamentos,Grietas en la pared derecha,,,,19.3656674,-99.1387516,
487,487,Breta+//0A7f/9ALE-a,,Benito Ju+//0A7f/9AOc-rez,,+ACI-http://maps.google.com/maps?q+AD0-loc:19.371955,-99.1325189+ACI-,,,,,,,,,105,,,,,,Dr vertiz y Dr Andrade,,Departamentos,Derrumbe y fuga de gas,,,,19.371955,-99.1325189,
488,488,Tlalpan,,Benito Ju+//0A7f/9AOc-rez,,+ACI-http://maps.google.com/maps?q+AD0-loc:19.2842714,-99.2096257+ACI-,,,,,,,,,550,,,,,,Eje 10 y Tecuani,,Departamentos,+ACI-Fractura en la estructura de escaleras, paredes, y y afectaciones a departamentos en general.+ACI-,,,,19.2842714,-99.2096257,
489,489,Van dick 33,,Benito Ju+//0A7f/9AOc-rez,,+ACI-http://maps.google.com/maps?q+AD0-loc:19.378785,-99.1890583+ACI-,,,,,,,,,1,,,,,,eje 8 sur popocatepetl y nevado,,Departamentos,Grietas por todo el departamento,,,,19.378785,-99.1890583,
490,490,Av. Insurgentes Sur,,Benito Ju+//0A7f/9AOc-rez,,+ACI-http://maps.google.com/maps?q+AD0-loc:19.3725709,-99.1796078+ACI-,,,,,,,,,1341,,,,,,Ejidatarios y Comuneros,,Departamentos,Grietas,,,,19.3725709,-99.1796078,
491,491,Enrique rebsamen,,Benito Ju+//0A7f/9AOc-rez,,+ACI-http://maps.google.com/maps?q+AD0-loc:19.398975,-99.1588969+ACI-,,,,,,,,,241,,,,,,Esquina con Pilares y Tlacoquemecatl,,Departamentos,Edificio colapsado,,,,19.398975,-99.1588969,
492,492,San Borja,,Benito Ju+//0A7f/9AOc-rez,,+ACI-http://maps.google.com/maps?q+AD0-loc:19.3809638,-99.1480977+ACI-,,,,,,,,,108,,,,,,Francia y NA,,Oficinas,Grieta,,,,19.3809638,-99.1480977,
493,493,Gonz+//0A7f/9AOc-lez de Cossio,,Benito ju+//0A7f/9AOc-rez,,+ACI-http://maps.google.com/maps?q+AD0-loc:19.3885558,-99.1704996+ACI-,,,,,,,,,353,,,,,,Guaymas y Morelia,,Departamentos,+ACI-Grietas en paredes, plafones movidos y descuadramiento de puertas+ACI-,,,,19.3885558,-99.1704996,
494,494,Azores,,Benito Ju+//0A7f/9AOc-rez,,+ACI-http://maps.google.com/maps?q+AD0-loc:19.3670858,-99.1549773+ACI-,,,,,,,,,609,,,,,,Miguel jacintes y Calle 11,,Departamentos,+ACI-El edificio frontal tiene severos da+//0A7f/9ALE-os, las columnas parece que van a colapsar+ACI-,,,,19.3670858,-99.1549773,
495,495,Alfonso XIII n+//0A7QBf-mero. 123,,Benito Ju+//0A7f/9AOc-rez,,+ACI-http://maps.google.com/maps?q+AD0-loc:19.4004104,-99.1433845+ACI-,,,,,,,,,5,,,,,,NA y NA,,Otro,Grietas,,,,19.4004104,-99.1433845,
496,496,Agust+//0A7QBf-n Gonz+//0A7f/9AOc-lez de Cossio,,Benito Ju+//0A7f/9AOc-rez,,+ACI-http://maps.google.com/maps?q+AD0-loc:19.3922496,-99.1694129+ACI-,,,,,,,,,123,,,,,,NA y NA,,Departamentos,Grietas y cuarteaduras en varios muros y pilares. Especialmente en pisos inferiores. Cristales rotos.,,,,19.3922496,-99.1694129,
497,497,Gabriel Mancera,,Benito Ju+//0A7f/9AOc-rez,,+ACI-http://maps.google.com/maps?q+AD0-loc:19.3745734,-99.1670182+ACI-,,,,,,,,,1332,,,,,,NA y NA,,Oficinas,Edificio con severas cuarteaduras,,,,19.3745734,-99.1670182,
498,498,Indianapolis,,Benito Ju+//0A7f/9AOc-rez,,+ACI-http://maps.google.com/maps?q+AD0-loc:19.3942218,-99.1774399+ACI-,,,,,,,,,8,,,,,,NA y NA,,Oficinas,,,,,19.3942218,-99.1774399,
499,499,Patricio Sanz,,Benito Ju+//0A7f/9AOc-rez,,+ACI-http://maps.google.com/maps?q+AD0-loc:19.3915946,-99.1701579+ACI-,,,,,,,,,612,,,,,,NA y NA,,Oficinas,+ACI-Edificio asentado, muros internos destrozados, grandes grietas en todos los departamentos de los 6 niveles.+ACI-,,,,19.3915946,-99.1701579,
500,500,Xochicalco,,Benito Ju+//0A7f/9AOc-rez,,+ACI-http://maps.google.com/maps?q+AD0-loc:19.3970237,-99.1538642+ACI-,,,,,,,,,121,,,,,,NA y NA,,Casa,Despu+//0A7f/9AKk-s del sismo se abri+//0A7QBf- una grieta a lo largo de las escaleras que conectan la entrada y el primer piso.,,,,19.3970237,-99.1538642,
501,501,Eje 8,,Benito Ju+//0A7f/9AOc-rez,,+ACI-http://maps.google.com/maps?q+AD0-loc:19.3653032,-99.1645444+ACI-,,,,,,,,,,,,,,,Oaxaca y Monterrey,,Departamentos,,,,,19.3653032,-99.1645444,
502,502,Enrique Rebsamen,,Benito Ju+//0A7f/9AOc-rez,,+ACI-http://maps.google.com/maps?q+AD0-loc:19.4026276,-99.1581907+ACI-,,,,,,,,,22,,,,,,Oaxaca y Monterrey,,Departamentos,Completamente inhabitable,,,,19.4026276,-99.1581907,
503,503,Pit+//0A7f/9AOc-goras,,Benito Ju+//0A7f/9AOc-rez,,+ACI-http://maps.google.com/maps?q+AD0-loc:19.3962684,-99.157399+ACI-,,,,,,,,,308,,,,,,Orion y Perseo,,Casa,Da+//0A7f/9ALE-os por dentro del edificio como por fuera,,,,19.3962684,-99.157399,
504,504,Gabriel Mancera,,Benito Ju+//0A7f/9AOc-rez,,+ACI-http://maps.google.com/maps?q+AD0-loc:19.400497,-99.1611247+ACI-,,,,,,,,,28,,,,,,Paseo de los nogales y Paseo de los naranjos,,Departamentos,Grietas,,,,19.400497,-99.1611247,
505,505,Avenida Universidad,,Benito Ju+//0A7f/9AOc-rez,,+ACI-http://maps.google.com/maps?q+AD0-loc:19.3770223,-99.1606079+ACI-,,,,,,,,,650,,,,,,Pilares y Mat+//0A7QBf-as Romero,,,Grietas y ca+//0A7QBf-da de vidrios,,,,19.3770223,-99.1606079,
506,506,Saratoga y Av Emiliano Zapata,,Benito Ju+//0A7f/9AOc-rez,,+ACI-http://maps.google.com/maps?q+AD0-loc:19.3656564,-99.1515032+ACI-,,,,,,,,,,,,,,,San Borja y NA,,Departamentos,Edificio da+//0A7f/9ALE-ado con sobrevivientes atrapados,,,,19.3656564,-99.1515032,
507,507,Diagonal San Antonio,,Benito Ju+//0A7f/9AOc-rez,,+ACI-http://maps.google.com/maps?q+AD0-loc:19.3939695,-99.159357+ACI-,,,,,,,,,1118,,,,,,Tejocotes y Fresas,,Departamentos,+ACI-Asentamientos, da+//0A7f/9ALE-o en estructura, el edificio est+//0A7f/9AOc- inclinado.+ACI-,,,,19.3939695,-99.159357,
508,508,Av Patriotismo,,Benito Ju+//0A7f/9AOc-rez,,+ACI-http://maps.google.com/maps?q+AD0-loc:19.3816723,-99.184138+ACI-,,,,,,,,,635,,,,,,Tochtli y Mizquic,,Casa,Techos y paredes cuarteados,,,,19.3816723,-99.184138,
509,509,Cuauht+//0A7f/9AKk-moc y diagonal de san Antonio,,Benito Ju+//0A7f/9AOc-rez,,+ACI-http://maps.google.com/maps?q+AD0-loc:19.3959619,-99.1560554+ACI-,,,,,,,,,,,,,,,xocongo y clavijero,,Comercio,+ACI-Se derrumb+//0A7QBf- parcial y hay temor de los vecinos de que se caiga me los edificios de los lados , el edificio es el de gobierno en la esquina de cuauhtemoc y diagonal de san Antonio en Narvarte+ACI-,,,,19.3959619,-99.1560554,
510,510,Mitla,,Benito Ju+//0A7f/9AOc-rez,,+ACI-http://maps.google.com/maps?q+AD0-loc:19.3991286,-99.1494383+ACI-,,,,,,,,,23,,,,,,Xola y Romero de Terreros,,Departamentos,+ACI-Fachada cuarteada, desprendimiento parte de fachada, cuarteaduras en interior departamento 2 muy evidentes.+ACI-,,,,19.3991286,-99.1494383,
511,511,Castilla,,Benito Ju+//0A7f/9AOc-rez,,+ACI-http://maps.google.com/maps?q+AD0-loc:19.395576,-99.1430215+ACI-,,,,,,,,,182,,,,,,Zapata y Rep+//0A7QBf-blicas,,Departamentos,Edificio ladeado,,,,19.395576,-99.1430215,
512,512,Zempoala,,Benito Ju+//0A7f/9AOc-rez,Narvarte,+ACI-http://maps.google.com/maps?q+AD0-loc:19.3904025,-99.1487949+ACI-,,,,,,,,,303,,,,,,M+//0A7f/9AKk-xico Tacuba y Mar Negro,,Casa,,,,,19.3904025,-99.1487949,
513,513,Anax+//0A7f/9AOc-goras,,Benito Ju+//0A7f/9AOc-rez,Narvarte Poniente,+ACI-http://maps.google.com/maps?q+AD0-loc:19.3913161,-99.1572627+ACI-,,,,,,,,,579,,,,,,Toluca y Acayucan,,Departamentos,Grietas en paredes y escalera,,,,19.3913161,-99.1572627,
514,514,La negra,,Benito Ju+//0A7f/9AOc-rez,Nezahualc+//0A7QBf-yotl,+ACI-http://maps.google.com/maps?q+AD0-loc:19.4186572,-99.0122989+ACI-,,,,,,,,,357,,,,,,Avenida ma+//0A7f/9ALE-anitas y rancho grande,,,Grietas y aberturas grandes  no es posible cerra puerta.,,,,19.4186572,-99.0122989,
515,515,Tanana,,Benito Ju+//0A7f/9AOc-rez,Piedad Narvarte,+ACI-http://maps.google.com/maps?q+AD0-loc:19.4022429,-99.1616888+ACI-,,,,,,,,,4,,,,,,Av 479 y Av 483,,Otro,Grietas en departamentos,,,,19.4022429,-99.1616888,
516,516,Antillas,,Benito Ju+//0A7f/9AOc-rez,Portales Sur,+ACI-http://maps.google.com/maps?q+AD0-loc:19.3611245,-99.1442542+ACI-,,,,,,,,,908,,,,,,Paseo del Bosque y Paseo Chico.,,Casa,Ca+//0A7QBf-da de transformador de electricidad,,,,19.3611245,-99.1442542,
517,517,Saratoga,,Benito Ju+//0A7f/9AOc-rez,+ACI-Portales, Benito Ju+//0A7f/9AOc-rez, CDMX+ACI-,+ACI-http://maps.google.com/maps?q+AD0-loc:19.3648893,-99.1517007+ACI-,,,,,,,,,714,,,,,,Eje 4 y eje 5 y Lago salinas y lago bajo,,Casa,Colaps+//0A7QBf- el edificio planta baja y primer piso aplastados,,,,19.3648893,-99.1517007,
518,518,Av. Coyoac+//0A7f/9AOc-n,,Benito Ju+//0A7f/9AOY-rez,,+ACI-http://maps.google.com/maps?q+AD0-loc:19.3709881,-99.1718328+ACI-,,,,,,,,,1435,,,,,,Quinta oriente y Sexta Oriente,,Casa,Cuarteaduras. No sobrepasan la pared.,,,,19.3709881,-99.1718328,
519,519,Juan de la barrera,,Benito Jurez,Ciudad de M+//0A7f/9AKk-xico,+ACI-http://maps.google.com/maps?q+AD0-loc:19.3859726,-99.1407886+ACI-,,,,,,,,,24,,,,,,Ni+//0A7f/9ALE-os h+//0A7f/9AKk-roes de chapultepe y Romero,,,Escaleras de conexi+//0A7QBf-n de departamentos por la parte de abajo tiene grietas,,,,19.3859726,-99.1407886,
520,520,L+//0A7f/9AOc-zaro C+//0A7f/9AOc-rdenas  eje central,,Benito justez,Cdmx,+ACI-http://maps.google.com/maps?q+AD0-loc:19.3685973,-99.1502921+ACI-,,,,,,,,,418,,,,,,Eje 6 Oriente y Playa Olas Altas,,Otro,+ACI-Muros fracturados,fachada, vidrios+ACI-,,,,19.3685973,-99.1502921,
521,521,Filadelfia y Dakota,,BJ,,,,,,,,,,,,,,,,,Fray Servando y Y chimalpopocan,,Departamentos,Poste de luz a punto de caerse,,,,,,
522,522,Urano,,Boca del r+//0A7QBf-o,,+ACI-http://maps.google.com/maps?q+AD0-loc:19.1581907,-96.1160608+ACI-,,,,,,,,,1500,,,,,,Flores magon y Eligi+//0A7QBf- ancona,,Departamentos,Cuarteadura peque+//0A7f/9ALE-a en cristal de fachada,,,,19.1581907,-96.1160608,
523,523,Andador valle de los robles,,Bosques de San Sebasti+//0A7f/9AOc-n,,,,,,,,,,,28,,,,,,Guillermo prieto y Viaducto,,Departamentos,Grietas en la parte de arriba del edificio,,,,,,
524,524,,,BUENAVISTA,ESTADO DE MEXICO  ZUMPANGO,+ACI-http://maps.google.com/maps?q+AD0-loc:19.4458447,-99.1497664+ACI-,,,,,,,,,,,,,,,,,,,,,,19.4458447,-99.1497664,
525,525,Av. Real de Atizapan,,Cd. Lopez Mateos,Atizapan de Zaragoza,+ACI-http://maps.google.com/maps?q+AD0-loc:19.5953251,-99.2566739+ACI-,,,,,,,,,37,,,,,,G+//0A7QBf-mez Farias y Morelos,,Oficinas,Grietas en paredes y cerca de los marcos de las ventanas.,,,,19.5953251,-99.2566739,
526,526,Isabel la cat+//0A7QBf-lica,,Centro,Ciudad de M+//0A7f/9AKk-xico,+ACI-http://maps.google.com/maps?q+AD0-loc:19.4261267,-99.1379325+ACI-,,,,,,,,,,,,,,,Bolivar,,Edificio,,,,,19.4261267,-99.1379325,
527,527,Azucena,,Centro,Cordoba.ver,+ACI-http://maps.google.com/maps?q+AD0-loc:17.9691502,-92.9057443+ACI-,,,,,,,,,4318,,,,,,calzada san antonio abad y 42771,,Departamentos,Hay grietas en paredes y techo de la casa hoyos,,,,17.9691502,-92.9057443,
528,528,Leyva,,Centro,Cuernavaca,+ACI-http://maps.google.com/maps?q+AD0-loc:22.8367483,-105.7775373+ACI-,,,,,,,,,3,,,,,,Ca+//0A7f/9ALE-ada de martha y Ca+//0A7f/9ALE-ada de la cruz,,Casa,,,,,22.8367483,-105.7775373,
529,529,1,,centro,df,+ACI-http://maps.google.com/maps?q+AD0-loc:18.9070167,-97.0828338+ACI-,,,,,,,,,2,,,,,,F+//0A7f/9AKk-lix cuevas y Parroquia,,Departamentos,total,,,,18.9070167,-97.0828338,
530,530,Avenida 5 de mayo,,Centro,Huejotzingo Puebla,+ACI-http://maps.google.com/maps?q+AD0-loc:18.2747054,-96.0006523+ACI-,,,,,,,,,315,,,,,,Ayuntamiento y Cerrada del trabajo,,Departamentos,Derrumbe de techo,,,,18.2747054,-96.0006523,
531,531,2 poniente,,Centro,Puebla,+ACI-http://maps.google.com/maps?q+AD0-loc:18.8860911,-97.7280549+ACI-,,,,,,,,,101,,,,,,5 de mayo y 3 norte,,,Grietas en gran parte del edificio,,,,18.8860911,-97.7280549,
532,532,Juarez e Hidalgo,,Centro,Toluca,+ACI-http://maps.google.com/maps?q+AD0-loc:20.4360435,-103.9298397+ACI-,,,,,,,,,1100,,,,,,43059 y Narciso Mendoza,,Casa,+ACI-Est+//0A7f/9AOc-n los edificios a simple vista con cierta inclinaci+//0A7QBf-n, y aun as+//0A7QBf- siguen laboraron+ACI-,,,,20.4360435,-103.9298397,
533,533,Hidalgo esq Gonz+//0A7f/9AOc-lez y pichardo,,Centro,Toluca,+ACI-http://maps.google.com/maps?q+AD0-loc:19.2900421,-99.663802+ACI-,,,,,,,,,,,,,,,La morena y Xola,,Departamentos,Grietas en muros y escaleras,,,,19.2900421,-99.663802,
534,534,Primera cerrada de naranjo,,Chalco,Chalco,+ACI-http://maps.google.com/maps?q+AD0-loc:19.2651293,-98.9029505+ACI-,,,,,,,,,5,,,,,,Por ex conasupo y Andador de los brasile+//0A7f/9ALE-os,,Departamentos,+ACI-De vino a bajo una barda de mi casa, y parte del cuarto de mi papa+ACI-,,,,19.2651293,-98.9029505,
535,535,Xochiquetzal,,Chalco,Estado de M+//0A7f/9AKk-xico,+ACI-http://maps.google.com/maps?q+AD0-loc:19.2663198,-98.9017316+ACI-,,,,,,,,,44,,,,,,Pur+//0A7f/9AKk-pechas y yaquis,,,Grietas en barda perimetral,,,,19.2663198,-98.9017316,
536,536,paSeos de chalco,,chalco,,+ACI-http://maps.google.com/maps?q+AD0-loc:19.2407249,-98.8941696+ACI-,,,,,,,,,,,,,,,Pe+//0A7f/9ALE-on y toltecas y NA,,Departamentos,Se call+//0A7QBf- una barda de la escuela Albert Einstein.,,,,19.2407249,-98.8941696,
537,537,Girasoles,,Chalco Edo. Mex.,San Mateo huitzilzingo,+ACI-http://maps.google.com/maps?q+AD0-loc:19.3226205,-98.9271909+ACI-,,,,,,,,,5,,,,,,Ampliaci+//0A7QBf-n Zaragoza y tulipanes,,,Tiene grietas muy pronunciadas en una habitacion y todo +//0A7f/9AKk-l patio  tambien la barda perimetral,,,,19.3226205,-98.9271909,
538,538,Tulipanes,,Chiapas,Chiapa de corzo,+ACI-http://maps.google.com/maps?q+AD0-loc:16.7648524,-93.1633663+ACI-,,,,,,,,,9612036288,,,,,,Carretera a CD Hidalgo y Cerca del kil+//0A7QBf-metro 10,,Casa,Est+//0A7f/9AOc- cuarteado,,,,16.7648524,-93.1633663,
539,539,Mejoramiento del ambiente,,Chicoloapan,Chicoloapan,+ACI-http://maps.google.com/maps?q+AD0-loc:19.4131423,-98.9023374+ACI-,,,,,,,,,SN,,,,,,Reforma y Mina,,Iglesia,Derrumbe de c+//0A7QBf-pula del campanario,,,,19.4131423,-98.9023374,
540,540,+ACI-Av central y canal neza, av bordo y canal neza (son los puentes vehiculares)+ACI-,,+ACI-Chimalhuacan, edo. Mex.+ACI-,,,,,,,,,,,,,,,,,Toluca y Av. Cuauht+//0A7f/9AKk-moc,,Oficinas,Se agrietaron los puentes,,,,,,
541,541,Puente oirdo de xochiaca,,Chimalhuancan,Mexico,+ACI-http://maps.google.com/maps?q+AD0-loc:19.4161151,-98.996608+ACI-,,,,,,,,,,,,,,,,,Puente,,,,,19.4161151,-98.996608,
542,542,carretera a coronango,,Cholula,Puebla,+ACI-http://maps.google.com/maps?q+AD0-loc:19.0838902,-98.3006659+ACI-,,,,,,,,,4369,,,,,,camino a ocotlan,,,grietas en forma de escalera en departamentos y edificios,,,,19.0838902,-98.3006659,
543,543,Texcoco,,Ciudad Azteca,Estado de M+//0A7f/9AKk-xico,+ACI-http://maps.google.com/maps?q+AD0-loc:19.5345916,-99.0274305+ACI-,,,,,,,,,,,,,,,Maestro rural y Plan de ayala,,Departamentos,Grietas en las paredes,,,,19.5345916,-99.0274305,
544,544,lago 4 millones Mz 87 Lt 12,,Ciudad Lago,,+ACI-http://maps.google.com/maps?q+AD0-loc:19.4505717,-99.0491874+ACI-,,,,,,,,,5547867916,,,,,,Calle 9 y7 y 9 y7,,Departamentos,Grietas presentadas en la habitaci+//0A7QBf-n de la cocina y una grieta con posici+//0A7QBf-n de 45 en escalera de entrada al primer piso,,,,19.4505717,-99.0491874,
545,545,Isabeles,,Ciudad Nezahualc+//0A7QBf-yotl,,+ACI-http://maps.google.com/maps?q+AD0-loc:19.4127681,-98.9993539+ACI-,,,,,,,,,394,,,,,,Panzacola y Margaritas,,Departamentos,Da+//0A7f/9ALE-o estructurales,,,,19.4127681,-98.9993539,
546,546,uh. san rafel mz h lote 6,,coacaalco de berriozabal,coacalco de berriozabal,+ACI-http://maps.google.com/maps?q+AD0-loc:19.6496241,-99.083374+ACI-,,,,,,,,,501,,,,,,Oriente 83 y Rio consulado,,Casa,Grietas y separacion del edificios,,,,19.6496241,-99.083374,
547,547,Felipe Vinicio,,Coacalco,Coacalco Estado de M+//0A7f/9AKk-xico,+ACI-http://maps.google.com/maps?q+AD0-loc:19.6627264,-99.1017329+ACI-,,,,,,,,,0,,,,,,42771 y Cerca del Hospital Homeop+//0A7f/9AOc-tico,,Departamentos,Es un CAM est+//0A7f/9AOc- muy agrietada la escuela y son ni+//0A7f/9ALE-os con capacidades diferentes muchos en silla de ruedas,,,,19.6627264,-99.1017329,
548,548,Potrero popular,,Coacalco,,+ACI-http://maps.google.com/maps?q+AD0-loc:19.6498404,-99.0761798+ACI-,,,,,,,,,318,,,,,,316 y 318,,Casa,,,,,19.6498404,-99.0761798,
549,549,Eje 8 carlos pichardo cruz MZ H LOTE 25,,Coacalco edomex,,,,,,,,,,,,,,,,,Oaxaca y Monterrey,,Departamentos,Se paracion de escaleras de paredes y grietas en trabes de edificios,,,,,,
550,550,Av chapultepec,,Col roma,Col roma,+ACI-http://maps.google.com/maps?q+AD0-loc:19.4230391,-99.1643976+ACI-,,,,,,,,,328,,,,,,C cedro y C chapultepec,,Otro,Grietas enormes y abiertas en habitaciones muros y escaleras,,,,19.4230391,-99.1643976,
551,551,Av chapultepec,,Col roma,Col roma,+ACI-http://maps.google.com/maps?q+AD0-loc:19.4230391,-99.1643976+ACI-,,,,,,,,,328,,,,,,Francisco montes de Oca y NA,,Casa,Da+//0A7f/9ALE-o a la estructura grietas enormes en pisos escaleras muros y habitaciones,,,,19.4230391,-99.1643976,
552,552,Avila camacho,,Col. Avila camacho / distrito 1 morelos,Cuernavaca,,,,,,,,,,,,,,,,Agiabampo y Roa B+//0A7f/9AOc-rcenas,,Casa,Derrumbe parcial de ladrillos hacia calle calzada de los reyes,,,,,,
553,553,Av. Miguel Hidalgo,,Col. Bienestar Social,+ACI-Tuxtla Gutierrez, Chiapas+ACI-,,,,,,,,,,506,,,,,,Campeche y Vicente Suarez,,Departamentos,Grietas en algunas esquinas de la casa,,,,,,
554,554,Rancho Tamboreo,,Colegio rebsamen,,+ACI-http://maps.google.com/maps?q+AD0-loc:19.2966173,-99.1305751+ACI-,,,,,,,,,14300,,,,,,Asia y Guinea,,Casa,Fatima Navarro esta viva entre los escombros,,,,19.2966173,-99.1305751,
555,555,Ministerio publico,,Colocia centro,Chilpancingo,+ACI-http://maps.google.com/maps?q+AD0-loc:19.4227351,-99.1371609+ACI-,,,,,,,,,0,,,,,,Rio Tigris y Rio Sena,,Departamentos,Departamento en 4 piso con ligeras grietas en distintas partes del inmueble.,,,,19.4227351,-99.1371609,
556,556,Circuito Oyamel,,Colonia del Bosque,+ACI-Cuernavaca, Morelos+ACI-,,,,,,,,,,311,,,,,,Durango y Puebla,,Departamentos,+ACI-Una rama de media tonelada sobre cables encima de media calle, no se puede pasar y est+//0A7f/9AOc- en riesgo de caer sobre la calle y llevarse postes y cables, mismos que afectar+//0A7f/9AOc-n casas aleda+//0A7f/9ALE-as.+ACI-,,,,,,
557,557,Pedro moreno,,Colonia las salinas,Texcoco edo.mex,+ACI-http://maps.google.com/maps?q+AD0-loc:19.4417099,-99.1451067+ACI-,,,,,,,,,5951099420,,,,,,Oriente 167 y Oriente 169,,Casa,Grietas y aberturas en todo el edificio departamental,,,,19.4417099,-99.1451067,
558,558,Las rosas,,Colonia las verdes del pedregal,Chignautla puebla,,,,,,,,,,45,,,,,,Manuel marquez sterling y Arcos de belem,,Departamentos,Grietas en paredes y losa,,,,,,
559,559,Carretera a mariscala,,Colonia los pinos,Huajuapan de leon oaxaca,+ACI-http://maps.google.com/maps?q+AD0-loc:17.5697463,-99.5149582+ACI-,,,,,,,,,3,,,,,,Rosa y Clavel,,Casa,Casa inhabitable,,,,17.5697463,-99.5149582,
560,560,Camino carretero,,Colonia martires,+ACI-Juchitan, oaxaca+ACI-,+ACI-http://maps.google.com/maps?q+AD0-loc:16.4499645,-95.0097587+ACI-,,,,,,,,,46,,,,,,Malinalco y Pirules,,Departamentos,Entrada y barda apunto de colapse,,,,16.4499645,-95.0097587,
561,561,Oriente 8,,Colonia Reforma,Nezahualc+//0A7QBf-yotl,+ACI-http://maps.google.com/maps?q+AD0-loc:19.3700313,-98.9843698+ACI-,,,,,,,,,93,,,,,,Rio Grijalva y Villalongin,,Departamentos,Calle agrietada bastante abierto undimiento de la misma casas pandeadas incluyendo la m+//0A7QBf-a banquetas separadas casa tambi+//0A7f/9AKk-n derrumbe de una barda por dentro del domicilio afectando de igual manera la mia,,,,19.3700313,-98.9843698,
562,562,Medellin,,Colonia roma,Cdmx,+ACI-http://maps.google.com/maps?q+AD0-loc:19.4135577,-99.1651891+ACI-,,,,,,,,,153,,,,,,Toledo y Xola,,Departamentos,,,,,19.4135577,-99.1651891,
563,563,Pachuca,,Condesa,CDMX,+ACI-http://maps.google.com/maps?q+AD0-loc:19.4148063,-99.1776257+ACI-,,,,,,,,,104,,,,,,Fernando Montes de Oca y Juan Escutia,,,Hay grietas en el frente del edificio y olor a gas adentro,,,,19.4148063,-99.1776257,
564,564,Zamora ,Condesa,Condesa,CDMX,https://www.google.com.mx/maps/dir/''/centraal/data+AD0AIQ-4m5+ACE-4m4+ACE-1m0+ACE-1m2+ACE-1m1+ACE-1s0x85d1ff5c96fc9085:0x2f6aec40a6a0a8b0?sa+AD0-X+ACY-ved+AD0-0ahUKEwjwkvz7t7TWAhXEeSYKHcQOBiQQ9RcIpwEwEg,,,,,,,,,187,,,,,,Francisco Marquez y Circuito Interior,,Oficinas,Grietas y posible derrumbe del edificio contiguo,,,,19.4120664,-99.2506928,
565,565,Francisco Marquez,Condesa,Condesa,Ciudad de Mexico,+ACI-https://www.google.com.mx/maps/place/Plaza+Comunitaria+INEA//0AQA-19.4126293,-99.1811888,19z/data+AD0AIQ-3m1+ACE-4b1+ACE-4m15+ACE-1m9+ACE-4m8+ACE-1m3+ACE-2m2+ACE-1d-99.1808266+ACE-2d19.4122283+ACE-1m3+ACE-2m2+ACE-1d-99.1808266+ACE-2d19.4122283+ACE-3m4+ACE-1s0x85d1f8ca878c4619:0x6cec0d145c3c09a1+ACE-8m2+ACE-3d19.412628+ACE-4d-99.1806403+ACI-,,,,,,,,,160,,,,,,Instituto Nacional para la Educaci+//0A7QBf-n de los Adultos,,Oficinas,Edificio con da+//0A7f/9ALE-os estructurales y posibilidades de derrumbe. Protecci+//0A7QBf-n Civil ya est+//0A7f/9AOc- al tanto de los da+//0A7f/9ALE-os. Desalojo de edificios y casas contiguas.,,,,19.4126293,-99.1811888,
566,566,Filosof+//0A7QBf-a y Letras,,Copilco-universidad,,+ACI-http://maps.google.com/maps?q+AD0-loc:19.3343647,-99.1782046+ACI-,,,,,,,,,21,,,,,,Insurgentes y Florida,,Departamentos,+ACI-Grietas que atraviesan la pared, piso y techo+ACI-,,,,19.3343647,-99.1782046,
567,567,Calle Cerro Huitzilac,,Coyoacan,Campestre Churubusco,+ACI-http://maps.google.com/maps?q+AD0-loc:19.3408589,-99.1413484+ACI-,,,,,,,,,122,,,,,,Cerro San Antonio y Cerro del Pe+//0A7f/9ALH//QDtAF8-n,,,Grieta en muro de la escaleras y en estacionamiento,,,,19.3408589,-99.1413484,
568,568,Avenida Cerro De Las Torres 181,,Coyoacan,Campestre Churubusco,+ACI-http://maps.google.com/maps?q+AD0-loc:19.3441622,-99.1367656+ACI-,,,,,,,,,181,,,,,,Cerro Tezoyo y Miramontes,,,Grieta diagonal en planta baja de edificio de 4 pisos,,,,19.3441622,-99.1367656,
569,569,Rinconada de los personajes Edificio Pedro Paramo,,Coyoacan,Cd. de M+//0A7f/9AKk-xico,+ACI-http://maps.google.com/maps?q+AD0-loc:19.3082297,-99.1682659+ACI-,,,,,,,,,303  referencia Quinta seccion,,,,,,Av.iman y Libertad por la planta de asfalto,,,Cuarteadurasen la union de escaleras con el piso inferior de del tercer piso y segundo nivel,,,,19.3082297,-99.1682659,
570,570,Paseo nuevo,,Coyoacan,CD.MX.,+ACI-http://maps.google.com/maps?q+AD0-loc:19.3481718,-99.1213159+ACI-,,,,,,,,,43,,,,,,Garrido y Ticoman,,Departamentos,1985,,,,19.3481718,-99.1213159,
571,571,Callej+//0A7QBf-n de Torresco,,Coyoacan,CD.MX.,+ACI-http://maps.google.com/maps?q+AD0-loc:19.3506116,-99.1710361+ACI-,,,,,,,,,7,,,,,,Medell+//0A7QBf-n y Valladolid,,Departamentos,+ACI-Centro d Atenci+//0A7QBf-n M+//0A7QBf-ltiple 92 q comparte terreno con la escuela primaria oficial Republica de Guatemala, salones afectados con grietas, tabiques movidos, separaci+//0A7QBf-n de columnas de las paredes, comedor con grietas importantes q dan al otro lado del edificio, x favor, urge revisen la escuela+ACI-,,,,19.3506116,-99.1710361,
572,572,Paseo nuevo,,Coyoacan,CD.MX.,+ACI-http://maps.google.com/maps?q+AD0-loc:19.3481718,-99.1213159+ACI-,,,,,,,,,43,,,,,,Plaza de la luz y Plazas de aragon,,Casa,1985,,,,19.3481718,-99.1213159,
573,573,antonio delf+//0A7QBf-n madrigal,,coyoacan,cdmx,+ACI-http://maps.google.com/maps?q+AD0-loc:19.3329874,-99.1741593+ACI-,,,,,,,,,95,,,,,,+//0A7f/9AIE-msterdam y Campeche y NA,,Departamentos,Grietas en muros de concreto De algunos edificios,,,,19.3329874,-99.1741593,
574,574,Av canal de miramontes,,Coyoacan,Cdmx,+ACI-http://maps.google.com/maps?q+AD0-loc:19.3498457,-99.1359119+ACI-,,,,,,,,,1644,,,,,,Cerr+//0A7QBf- Loreto y cerro campanas,,Edificio,Cuarteaduras importantes en dos columnas de soporte y otras en pasillos y escaleras,,,,19.3498457,-99.1359119,
575,575,Av. Universidad,,Coyoacan,Cdmx,+ACI-http://maps.google.com/maps?q+AD0-loc:19.3392532,-99.1825435+ACI-,,,,,,,,,1953 edif 2,,,,,,Eje 10 y cerrada de Chimalistac,,,Grietas en la base del edificio tanto afuera como por adentro del edificio,,,,19.3392532,-99.1825435,
576,576,Cuarta calle Paseo Chico,,Coyoacan,CDMX,+ACI-http://maps.google.com/maps?q+AD0-loc:19.3503984,-99.1258017+ACI-,,,,,,,,,14,,,,,,Esq Paseo Chico,,,Grietas muy grandes y desprendimiento de concreto, edificio adyacente a punto de caer y recargado en su totalidad con el nuestro y con bastante olor a gas,,,,19.3503984,-99.1258017
577,577,Calzada del Hueso,,Coyoacan,CDMX,+ACI-http://maps.google.com/maps?q+AD0-loc:19.30412,-99.1238685+ACI-,,,,,,,,,480,,,,,,Esquina Canal de Miramontes,,,Se derrumb+//0A7QBf- la mitad del edificio.,,,,19.30412,-99.1238685,
578,578,Calzada de Tlalpan 2,,Coyoacan,CDMX,+ACI-http://maps.google.com/maps?q+AD0-loc:19.3147341,-99.1405181+ACI-,,,,,,,,,2971,,,,,,FRESNO Y EXTITLAN,,,Grietas  cuarteaduras  fuga de agua y gas. Conjunto B Grand Coyoacan,,,,19.3147341,-99.1405181,
579,579,Calzada de tlalpan,,Coyoacan,CDMX,+ACI-http://maps.google.com/maps?q+AD0-loc:19.3147341,-99.1405181+ACI-,,,,,,,,,2971,,,,,,Fresno y textitlan,,,Grietas estructurales  fugas de gas,,,,19.3147341,-99.1405181,
580,580,Av. Universidad 1330,,Coyoacan,Cdmx,+ACI-http://maps.google.com/maps?q+AD0-loc:19.3581551,-99.1714898+ACI-,,,,,,,,,Avignon 1002,,,,,,,,,Grietas estructurales en varias plantas. Edificio de 15 plantas,,,,19.3581551,-99.1714898,
581,581,Paseo duraznos,,Coyoacan,CDMX,+ACI-http://maps.google.com/maps?q+AD0-loc:19.3475339,-99.1250663+ACI-,,,,,,,,,65,,,,,,Nogales y naranjos,,,Da+//0A7f/9ALE-o total estructura edificio inhabitable,,,,19.3475339,-99.1250663,
582,582,Paseo nuevo,,COYOACAN,CDMX,+ACI-http://maps.google.com/maps?q+AD0-loc:19.3476826,-99.1210233+ACI-,,,,,,,,,54,,,,,,paseo del r+//0A7QBf-o y paseo de las magnolias,,,Estructural,,,,19.3476826,-99.1210233,
