,,Calle,Colonia,Delegaci+//0AkgBf-n,Estado,Foto,Herramientas Faltantes,Herramientas Sobrantes,Hora,Hora del Reporte,Mano de Obra Faltante,Mano de Obra Sobrantes,Medicamentos Faltantes,Medicamentos Sobrantes,N+//0AkgBf-mero Exterior  o Aproximado,N+//0AkgBf-mero de Personas Atrapadas,N+//0AkgBf-mero de Personas Desaparecidas,N+//0AkgBf-mero de Personas Fallecidas,N+//0AkgBf-mero de Personas Lesionadas,N+//0AkgBf-mero de Personas Rescatadas,Otra Referencia de Ubicaci+//0AkgBf-n ,Tipo de Infraestructura,Tipo de Uso,Tipo del Da+//0Akv/9ALE-o,Verificado,V+//0AkgBf-veres Faltantes ,V+//0AkgBf-veres Sobrantes ,latitud,longitud,
0,0,Armenta Y L+//0AkgBf-pez,,,Oaxaca,,,,,,,,,,,,,,,,,,,Cruz Roja Mexicana - Oaxaca,,,,17.05584526,-96.7251358,
1,1,Av. Ignacio Allende,,,Chiapas,,,,,,,,,,,,,,,,,,,Cruz Roja de S Crist+//0AkgBf-bal,,,,16.72674942,-92.64076233,
2,2,Sierrav+//0AkgBf-sta Y R+//0AkgBf-o Bamba,,,Cdmx,,,,,,,,,,,,,,,,,,,Derrumbe,,,,17.05994,-96.725051,
3,3,Laguna De Terminos Y Lago Cultezeo,,,Cdmx,,,,,,,,,,,,,,,,,,,Derrumbe,,,,19.442443,-99.174397,
4,4,Av Coyoacan Y Providencia,,,Cdmx,,,,,,,,,,,,,,,,,,,Derrumbe,,,,19.398604,-99.166853,
5,5,Escocia Y Nicolas,,,Cdmx,,,,,,,,,,,,,,,,,,,Derrumbe,,,,19.387305,-99.16245,
6,6,Eugenia Y Edinburgo,,,Cdmx,,,,,,,,,,,,,,,,,,,Derrumbe,,,,19.386598,-99.163642,
7,7,Peten Y Zapata,,,Cdmx,,,,,,,,,,,,,,,,,,,Derrumbe,,,,19.366511,-99.156891,
8,8,Gabriel Mancera Y Escocia,,,Cdmx,,,,,,,,,,,,,,,,,,,Derrumbe,,,,19.38766,-99.163934,
9,9,Yacatas Y Concepcion Beistegui,,,Cdmx,,,,,,,,,,,,,,,,,,,Derrumbe,,,,19.387366,-99.156062,
10,10,Balsas +ACM-18 Y Miravalle,,,Cdmx,,,,,,,,,,,,,,,,,,,Derrumbe,,,,19.360722,-99.140568,
11,11,Calz De Las Brujas Y Division Del Norte,,,Cdmx,,,,,,,,,,,,,,,,,,,Derrumbe,,,,19.296608,-99.13058,
12,12,Paseo De Las Galias  Y Av Tlahuac,,,Cdmx,,,,,,,,,,,,,,,,,,,Derrumbe,,,,19.32238,-99.09726,
13,13,Ermita Iztapalapa Y Calzada Dla Viga,,,Cdmx,,,,,,,,,,,,,,,,,,,Derrumbe,,,,19.357629,-99.121961,
14,14,10 De Abril Y Anenecuilco,,,Cdmx,,,,,,,,,,,,,,,,,,,Derrumbe,,,,19.316634,-99.109938,
15,15,Av San Ana Y Ejido Santa Cruz,Col. San Francisco Culhuac+//0Akv/9AI0-n,,Cdmx,,,,,,,,,,,,,,,,,,,Derrumbe,,,,19.329427,-99.124928,
16,16,Perif+//0Akv/9AKk-rico Y Circuito Cuemanco Norte,,,Cdmx,,,,,,,,,,,,,,,,,,,Derrumbe,,,,19.281995,-99.113168,
17,17,Rancho De Los Arcos Y Calz Del Hueso,,,Cdmx,,,,,,,,,,,,,,,,,,,Derrumbe,,,,19.303344,-99.12299,
18,18,Viaducto Y Av Coyoacan,,,Cdmx,,,,,,,,,,,,,,,,,,,Derrumbe,,,,19.400198,-99.167903,
19,19,Tlalpan Fovissste Y Calz De Tlalpan,,,Cdmx,,,,,,,,,,,,,,,,,,,Derrumbe,,,,19.340871,-99.143292,
20,20,Comonfort Y Jaime Nuno,,,Cdmx,,,,,,,,,,,,,,,,,,,Derrumbe,,,,19.445171,-99.135075,
21,21,Lerdo Y Magnolia,,,Cdmx,,,,,,,,,,,,,,,,,,,Derrumbe,,,,19.442598,-99.142839,
22,22,Mina 16 Y 2 De Abril,,,Cdmx,,,,,,,,,,,,,,,,,,,Derrumbe,,,,19.438887,-99.141669,
23,23,Laredo Y Amsterdam,,,Cdmx,,,,,,,,,,,,,,,,,,,Derrumbe,,,,19.414317,-99.170106,
24,24,Chimalpopoca Y Sim+//0AkgBf-n Bol+//0AkgBf-var,,,Cdmx,,,,,,,,,,,,,,,,,,,Derrumbe,,,,19.422269,-99.140019,
25,25,Tabasco Y Medell+//0AkgBf-n,,,Cdmx,,,,,,,,,,,,,,,,,,,Derrumbe,,,,19.417854,-99.166064,
26,26,Salamanca Esquina Oaxaca,,,Cdmx,,,,,,,,,,,,,,,,,,,Derrumbe,,,,19.417036,-99.169041,
27,27,Puebla 282 Esq Salamanca,,,Cdmx,,,,,,,,,,,,,,,,,,,Derrumbe,,,,19.421016,-99.170059,
28,28,Alvaro Obreg+//0AkgBf-n Y Valladolid,,,Cdmx,,,,,,,,,,,,,,,,,,,Derrumbe,,,,19.416907,-99.167314,
29,29,La Morena y Heriberto Frias,Narvarte Poniente,,Cdmx,,,,,,,,,,,,,,,,,,,Derrumbe,,,,19.398836,-99.15941,
30,30,La Morena y Enrique Rebsamen,Narvarte Poniente,,Cdmx,,,,,,,,,,,,,,,,,,,Derrumbe,,,,19.398892,-99.1586,
31,31,,,,Cdmx,,,,,,,,,,,,,,,,,,,CDMX,,,,,,
32,32,,,,Puebla,,,,,,,,,,,,,,,,,,,Puebla,,,,,,
33,33,,,,Morelos,,,,,,,,,,,,,,,,,,,Morelos - State,,,,,,
34,34,Calle Gabriel Mancera 740b,,,Cdmx,,,,,,,,,,,,,,,,,,,Derrumbe,,,,19.387547,-99.163825,
35,35,+ACI-Calle del Puente 222, Ejidos de Huipulco, San Bartolo el Chico, 14380 Tlalpan, CDMX+ACI-,,,Cdmx,,,,,,,,,,,,,,,,,,,Derrumbe,,,,19.283297,-99.135177,
36,36,Narciso Mendoza        Av. las Trancas,,,CDMX,,,,,,,,,,,,,,,,,,,Derrumbe,,,,19.293062,-99.12324,
37,37,MorelosMorelos        Comonfort        48,,,Morelos,,,,,,,,,,,,,,,,,,,Derrumbe,,,,19.445279,-99.135279,
38,38,Barrio 18        Ca+//0Akv/9ALE-averales        ,,,Cdmx,,,,,,,,,,,,,,,,,,,Derrumbe,,,,19.294597,-99.111725,
39,39,Barrio del Rosario        Pedro Ram+//0AkgBf-rez del Castillo,,,Cdmx,,,,,,,,,,,,,,,,,,,Derrumbe,,,,19.26345,-99.105373,
40,40,San Gregorio Atlapulco        Av. M+//0Akv/9AKk-xico,,,Cdmx,,,,,,,,,,,,,,,,,,,Derrumbe,,,,19.255266,-99.056425,
41,41,+ACI-Del Calvario 35
Santa Cruz Acalpixca
16500 Ciudad de M+//0Akv/9AKk-xico, CDMX+ACI-,,,Cdmx,,,,,,,,,,,,,,,,,,,Derrumbe,,,,19.244729,-99.073859,
42,42,+ACI-Av 16 de Septiembre
Santa Mar+//0AkgBf-a Tepepan
16020 Ciudad de M+//0Akv/9AKk-xico, CDMX+ACI-,,,cdmx,,,,,,,,,,,,,,,,,,,Derrumbe,,,,19.278074,-99.133672,
43,43,2da secci+//0A7QBf-n de Izapa,,2da secci+//0A7QBf-n de izapa,,,,,,,,,,,,,,,,,Viaducto y Amores,,Casa,Grietas en columnas riesgo de colapsar,,,,,,
44,44,Gustavo Diaz Ordaz,,Acapatzingo,Cuernavaca,,,,,,,,,,140,,,,,,Chapultepec y Marsella,,Oficinas,Grietas diagonales notables que soportan tanques de gas estacionario de 1000 litros  (3 tanques),,,,,,
45,45,U. Hab el coloso,,Acapulco guerrero,,+ACI-http://maps.google.com/maps?q+AD0-loc:16.846051,-99.8125646+ACI-,,,,,,,,,10,,,,,,Avenida prados y Avenida canal de castera,,Departamentos,Grietas en fachadas y escaleras grietas profundas con rriesco a colapsar estaleras de acceso al edif. Etap 10 edif. 39,,,,16.846051,-99.8125646,
46,46,Edificio 10 Departamento 402 Etapa 8 El Coloso,,+ACI-Acapulco, Gro.+ACI-,Acapulco,+ACI-http://maps.google.com/maps?q+AD0-loc:16.857814,-99.8166802+ACI-,,,,,,,,,402,,,,,,NA y NA,,Casa,+ACI-Grietas en escaleras y balcones. Podr+//0A7QBf-an desprenderse balcones y caer al frente a algun traunseunte, escaleras podr+//0A7QBf-an colapsar y evitar desalojo de edificio en caso de un sismo+ACI-,,,,16.857814,-99.8166802,
47,47,,,acatitla,mexico,+ACI-http://maps.google.com/maps?q+AD0-loc:19.3646763,-99.0055547+ACI-,,,,,,,,,,,,,,,,,,,,,,19.3646763,-99.0055547,
48,48,Coquimbo,Lindavista,Actualizado:20/SEP/2017 12:25 pm,CDMX,,,,,,+ACI-Ya no se est+//0A7f/9AOc- dejando pasar a voluntarios. Se necesita: Sueros, taladros,palas,herramientas para cortar metal. +ACI-,,,,911,,,,,,Sierravista y Ticom+//0A7f/9AOc-n,,residencial,Hay atrapados,,,,19.493558,-99.122916,
49,49,Sur 16 esquina con Oriente 245,,Agr+//0A7QBf-cola oriental,Ciudad de M+//0A7f/9AKk-xico,+ACI-http://maps.google.com/maps?q+AD0-loc:19.394192,-99.0707937+ACI-,,,,,,,,,,,,,,,Sur 12 y sur 20,,,Es un,,,,19.394192,-99.0707937,
50,50,Otilio Monta+//0A7f/9ALE-o,,Altavista,Cuernavaca,+ACI-http://maps.google.com/maps?q+AD0-loc:19.3116942,-99.2271845+ACI-,,,,,,,,,105,,,,,,Vergel y Cientificos,,Casa,Grietas fuertes en muros estructurales,,,,19.3116942,-99.2271845,
51,51,Iman,,Alvaro Obregon,Alvaro Obregon,+ACI-http://maps.google.com/maps?q+AD0-loc:19.3095318,-99.1745424+ACI-,,,,,,,,,660,,,,,,Insurgentes Sur y Zacatepetl,,Oficinas,Edificio 30 afectado por grietas,,,,19.3095318,-99.1745424,
52,52,(Edificios Altuz) Romulo Ofarril,,Alvaro obregon,Cdmx,+ACI-http://maps.google.com/maps?q+AD0-loc:19.337851,-99.211961+ACI-,,,,,,,,,468,,,,,,Andr+//0A7f/9AKk-s Molina Enr+//0A7QBf-quez y Eje tres,,Departamentos,Grietas o corteaduras en casi todas las paredes del departamento.,,,,19.337851,-99.211961,
53,53,Uruguallos,,Alvaro Obregon,CDMX,+ACI-http://maps.google.com/maps?q+AD0-loc:19.3870662,-99.2122348+ACI-,,,,,,,,,39,,,,,,Fray Servando y chimalpopocan y NA,,Departamentos,Grietas en paredes,,,,19.3870662,-99.2122348,
54,54,centenario,,alvaro obregon,cdmx,+ACI-http://maps.google.com/maps?q+AD0-loc:19.3516365,-99.2483818+ACI-,,,,,,,,,3002,,,,,,Ni+//0A7f/9ALE-os h+//0A7f/9AKk-roes y Dr Jim+//0A7f/9AKk-nez,,Departamentos,grietas en la estructura del edificio y departamentos,,,,19.3516365,-99.2483818,
55,55,1 de April,,Alvaro Obregon,Ciudad de Mexico,+ACI-http://maps.google.com/maps?q+AD0-loc:19.3167042,-99.2702479+ACI-,,,,,,,,,8,,,,,,Amanecer ranchero y Cuarta avenida,,Casa,+ACI-Cuarteadura en muro de tabique de planta baja, a 45 grados, en X se ve de lado a lado del muro.+ACI-,,,,19.3167042,-99.2702479,
56,56,INSURGENTES SUR,,Alvaro Obregon,CIUDAD DE MEXICO,+ACI-http://maps.google.com/maps?q+AD0-loc:19.3610398,-99.1835794+ACI-,,,,,,,,,1685,,,,,,Bosque de alf+//0A7f/9AKk-rez y Bosque de mayorazgo,,Departamentos,+ACI-PAREDES AGRIETADAS, PLAFONES CAIDOS, ESCALERAS DA+//0A7f/9AO8-ADAS+ACI-,,,,19.3610398,-99.1835794,
57,57,Insurgentes Sur,,Alvaro Obregon,Ciudad de Mexico,+ACI-http://maps.google.com/maps?q+AD0-loc:19.3581311,-99.1837581+ACI-,,,,,,,,,1768,,,,,,Marsella y Liverpool,,Departamentos,Grieta en muro,,,,19.3581311,-99.1837581,
58,58,Avenida Lomas del Plateros,,Alvaro Obregon,Ciudad de Mexico,+ACI-http://maps.google.com/maps?q+AD0-loc:19.3714919,-99.1949456+ACI-,,,,,,,,,D6,,,,,,,,edificio,Viga decorativa de cemento en la azotea con fractura y riesgo de ca+//0A7QBf-da,,,,19.3714919,-99.1949456,
59,59,Prolongacion Paseo de la Reforma,,Alvaro Obregon,Ciudad de Mexico,+ACI-http://maps.google.com/maps?q+AD0-loc:19.4260979,-99.2071747+ACI-,,,,,,,,,355,,,,,,,,,Grietas de Falsa Pared.,,,,19.4260979,-99.2071747,
60,60,Javier martinez valle,,Alvaro obregon,Ciudad de mexico,+ACI-http://maps.google.com/maps?q+AD0-loc:19.3993497,-99.1238042+ACI-,,,,,,,,,21,,,,,,Roque velazco ceron y escuadron 201,,,Cuarteaduras en la estructura y cuarteaduras en los pilares ke soportan los tinacos de agua,,,,19.3993497,-99.1238042,
61,61,Melchor ocampo,,Alvaro obregon,Ciudad de M+//0A7f/9AKk-xico,+ACI-http://maps.google.com/maps?q+AD0-loc:19.394717,-99.2122306+ACI-,,,,,,,,,38,,,,,,Art+//0A7QBf-culo 123 y Independencia,,Departamentos,,,,,19.394717,-99.2122306,
62,62,Francisco villa mz 18 lt 38,,Alvaro obregon,Colonia lomas de la era alvaro obregon,+ACI-http://maps.google.com/maps?q+AD0-loc:19.8236254,-101.036455+ACI-,,,,,23,,,,18,,,,,,Norte 3 y Norte 5,,Departamentos,+ACI-Se hizo una grieta en el centro del piso de la casa que la abri+//0A7QBf-. Asimismo, se hicieron gritas en las paredes y alredor de la casa y se rompieron una sisterna de agua, una pileta y los tubos y plomeria.+ACI-,,,,19.8236254,-101.036455,
63,63,Av central,,Alvaro obregon,Cuidad de mexico,+ACI-http://maps.google.com/maps?q+AD0-loc:19.3890213,-99.1944723+ACI-,,,,,,,,,220,,,,,,Diagonal san Antonio y Av central,,,Edificio de 15 pisos con muchas grietas en departamentos y pasillos,,,,19.3890213,-99.1944723,
64,64,Aureliano Rivera,,Alvaro obregon,Mexico,+ACI-http://maps.google.com/maps?q+AD0-loc:19.3361636,-99.2056283+ACI-,,,,,,,,,,,,,,,Chilpancingo y Culiacan,,Oficinas,Grietas y fisuras en departamentos y estructuras,,,,19.3361636,-99.2056283,
65,65,Camino real de minas,,Alvaro Obregon,M+//0A7f/9AKk-xico D.F.,+ACI-http://maps.google.com/maps?q+AD0-loc:19.3470377,-99.2137268+ACI-,,,,,,,,,17,,,,,,Bruno Traven y Pirineos,,Departamentos,Paredes con varias grietas,,,,19.3470377,-99.2137268,
66,66,Alejandro volta,,Alvaro Obregon,M+//0A7f/9AKk-xico D.F.,+ACI-http://maps.google.com/maps?q+AD0-loc:19.3673655,-99.2686653+ACI-,,,,,,,,,10,,,,,,Herculano sanches y Calle reforma,,Casa,Grietas en todo el edificio,,,,19.3673655,-99.2686653,
67,67,Av de las torres,,Alvaro obregon,,+ACI-http://maps.google.com/maps?q+AD0-loc:19.3339007,-99.240356+ACI-,,,,,,,,,805,,,,,,Aldama y NA,,Casa,Grietas en todos los pisos y edificios,,,,19.3339007,-99.240356,
68,68,Ferrocarril de Cuernavaca,,Alvaro Obregon,,+ACI-http://maps.google.com/maps?q+AD0-loc:19.3769618,-99.1923092+ACI-,,,,,,,,,188,,,,,,Boston y Holbein,,Departamentos,Grietas sobre el piso del departamento,,,,19.3769618,-99.1923092,
69,69,Av tamaulipas,,Alvaro obregon,,+ACI-http://maps.google.com/maps?q+AD0-loc:19.3649963,-99.2415232+ACI-,,,,,,,,,1236,,,,,,Dr neva y Dr norma,,Casa,Grietas y fuga de gas,,,,19.3649963,-99.2415232,
70,70,Ca+//0A7f/9ALE-ada Verde mz 9 lt,,Alvaro Obregon,,+ACI-http://maps.google.com/maps?q+AD0-loc:19.3825188,-99.2267081+ACI-,,,,,,,,,12,,,,,,Hidalgo y Ermita Iztapalapa,,Casa,+ACI-Hay un +//0A7f/9AOc-rbol dentro de mi domicilio y se deladeo con el sismo, esta por caer sobre mi casa que es de techo de l+//0A7f/9AOc-mina de asbesto tel 55 7745 2741+ACI-,,,,19.3825188,-99.2267081,
71,71,Sagredo,,Alvaro Obregon,,+ACI-http://maps.google.com/maps?q+AD0-loc:19.3607132,-99.1887147+ACI-,,,,,,,,,268,,,,,,Hojalateria y Ferrocaril de cintura,,Departamentos,,,,,19.3607132,-99.1887147,
72,72,Mimosa (Roberto Rios Elizondo),,Alvaro Obregon,,+ACI-http://maps.google.com/maps?q+AD0-loc:19.33528,-99.2359772+ACI-,,,,,,,,,87,,,,,,Juarez e Hidalgo y Juan Aldama y juarez,,Oficinas,el techo del ba+//0A7f/9ALE-o tiene grietas y desprendimientos y un pared del comedor una fisura,,,,19.33528,-99.2359772,
73,73,Toltecas,,Alvaro Obregon,,+ACI-http://maps.google.com/maps?q+AD0-loc:19.3871109,-99.1922417+ACI-,,,,,,,,,183,,,,,,Marina Nacional y Bahia de Santa Barbara y Bahia Chachalacas y Bahia de Palmas,,Casa,Grietas en paredes de edificio,,,,19.3871109,-99.1922417,
74,74,Barranca del muerto,,Alvaro obregon,,+ACI-http://maps.google.com/maps?q+AD0-loc:19.3622984,-99.1871811+ACI-,,,,,,,,,,,,,,,NA y NA,,Departamentos,Se cay+//0A7QBf- una barda de un estacionamiento  sobre 6 coches,,,,19.3622984,-99.1871811,
75,75,Ernesto j piper,,Alvaro obregon,,+ACI-http://maps.google.com/maps?q+AD0-loc:19.3693851,-99.2670033+ACI-,,,,,,,,,60,,,,,,Oaxaca y Monterrey,,Departamentos,Grietas en todo el edificio y parte de afuerA favor de revisar estructura,,,,19.3693851,-99.2670033,
76,76,Torres de mixcoac A-3,,Alvaro Obreg+//0A7QBf-n,Cd de M+//0A7f/9AKk-xico,+ACI-http://maps.google.com/maps?q+AD0-loc:19.3655403,-99.1945936+ACI-,,,,,,,,,903,,,,,,Coyuya y Coloxtitla,,Casa,Hay grietas en todos los pisos de los edificios,,,,19.3655403,-99.1945936,
77,77,Av central,,Alvaro Obreg+//0A7QBf-n,Cdmx,+ACI-http://maps.google.com/maps?q+AD0-loc:19.3890213,-99.1944723+ACI-,,,,,,,,,220,,,,,,Dr Barragan y Dr Andrade,,Departamentos,El edificio presenta diversas afectaciones visibles de cuartiaduras tamvi+//0A7f/9AKk-n se cayeron yeso en paredes el edificio es de 15 niveles y 5 sotanos de estacionamiento,,,,19.3890213,-99.1944723,
78,78,Carretera al Desierto de los Leoneses,,Alvaro Obreg+//0A7QBf-n,CDMX,+ACI-http://maps.google.com/maps?q+AD0-loc:19.326488,-99.2798772+ACI-,,,,,,,,,km 25,,,,,,,,Escuela,Edificio con ca+//0A7QBf-da de pared interior y grietas profundas.,,,,19.326488,-99.2798772,
79,79,Av Toluca,,Alvaro Obreg+//0A7QBf-n,,+ACI-http://maps.google.com/maps?q+AD0-loc:19.3367846,-99.2284202+ACI-,,,,,,,,,810,,,,,,Monterrey y Tonala,,Departamentos,Gritas en los pilares del estacionamiento,,,,19.3367846,-99.2284202,
80,80,Camino real a las Minas,,Alvaro Obreg+//0A7QBf-n,,+ACI-http://maps.google.com/maps?q+AD0-loc:19.3470377,-99.2137268+ACI-,,,,,,,,,17,,,,,,Primavera y Oto+//0A7f/9ALE-o,,Casa,Chistorras,,,,19.3470377,-99.2137268,
81,81,Carlos Dolci,,Alvaro Obreg+//0A7QBf-n,,+ACI-http://maps.google.com/maps?q+AD0-loc:19.3770316,-99.1943877+ACI-,,,,,,,,,96,,,,,,San Jeronimo y L+//0A7f/9AOc-zaro c+//0A7f/9AOc-rdenas,,Casa,Grieta horizontal a lo largo de la pared,,,,19.3770316,-99.1943877,
82,82,Edificio Cenpualteca DEMET San Antonio,,+//0A7f/9AIE-lvaro Obregon,Ciudad de Mexico,+ACI-http://maps.google.com/maps?q+AD0-loc:19.3850289,-99.1944048+ACI-,,,,,,,,,104,,,,,,Sobre la carretera Tenancingo hacia Villa Guerrero y NA,,Otro,Socav+//0A7QBf-n en una pared,,,,19.3850289,-99.1944048,
83,83,Prolongaci+//0A7QBf-n paseo de la reforma 215,,+//0A7f/9AIE-lvaro Obregon,DF,+ACI-http://maps.google.com/maps?q+AD0-loc:19.366766,-99.26794+ACI-,,,,,,,,,215 torre 1. 2 y 3,,,,,,,,,Grietas en todos los niveles de la torre 3,,,,19.366766,-99.26794,
84,84,Desierto de los leones 5510,,+//0A7f/9AIE-lvaro obregon,,+ACI-http://maps.google.com/maps?q+AD0-loc:19.338713,-99.2412649+ACI-,,,,,,,,,5510,,,,,,Oaxaca y Monterrey,,Comercio,Grieta,,,,19.338713,-99.2412649,
85,85,Camino al Desierto de los leones,,+//0A7f/9AIE-lvaro Obreg+//0A7QBf-n,Alcantarilla DF,+ACI-http://maps.google.com/maps?q+AD0-loc:19.3396178,-99.238616+ACI-,,,,,,,,,5445,,,,,,Texcoco y Uni+//0A7QBf-n,,Departamentos,+ACI-Grietas, muro ca+//0A7QBf-do, posibles da+//0A7f/9ALE-os a instalaci+//0A7QBf-n y tanque de Gas+ACI-,,,,19.3396178,-99.238616,
86,86,Av centenario,,+//0A7f/9AIE-lvaro Obreg+//0A7QBf-n,Cd mx,+ACI-http://maps.google.com/maps?q+AD0-loc:19.3664358,-99.2104187+ACI-,,,,,,,,,460,,,,,,aguascalientes y tlaxcala,,Oficinas,En la planta baja de un edificio se abri+//0A7QBf- una grieta como si dividieran el edificio en 2. Y las escaleras de un edificio pareciera que se separaron ligeramente del muro.,,,,19.3664358,-99.2104187,
87,87,Soledad,,+//0A7f/9AIE-lvaro Obreg+//0A7QBf-n,CD.MX.,+ACI-http://maps.google.com/maps?q+AD0-loc:19.2978633,-99.233973+ACI-,,,,,,,,,3,,,,,,Benito Ju+//0A7f/9AOc-rez y El pino,,Casa,Fisuras en paredes,,,,19.2978633,-99.233973,
88,88,Xochimilco,,+//0A7f/9AIE-lvaro Obreg+//0A7QBf-n,CDMX,+ACI-http://maps.google.com/maps?q+AD0-loc:19.365503,-99.2031306+ACI-,,,,,,,,,24,,,,,,5 mayo y centenario,,,Grietas al interior  al parecer no es muro de carga.,,,,19.365503,-99.2031306,
89,89,U Lomas de Becerra,,+//0A7f/9AIE-lvaro Obreg+//0A7QBf-n,CDMX,+ACI-http://maps.google.com/maps?q+AD0-loc:19.3838196,-99.2016798+ACI-,,,,,,,,,20,,,,,,Alta tensi+//0A7QBf-n y Antigua v+//0A7QBf-a a la venta,,,Ca+//0A7QBf-da parcial de +//0A7f/9AOc-rbol enfrente de edificio 20 a un lado de alarma sismica,,,,19.3838196,-99.2016798,
90,90,Cerrada Juan Tinoco 8,,+//0A7f/9AIE-lvaro Obreg+//0A7QBf-n,Cdmx,+ACI-http://maps.google.com/maps?q+AD0-loc:19.3650802,-99.1914619+ACI-,,,,,,,,,8,,,,,,Av Veracruz y Agust+//0A7QBf-n Melgar,,Departamentos,Grietas en paredes,,,,19.3650802,-99.1914619,
91,91,Avenida Universidad,,+//0A7f/9AIE-lvaro Obreg+//0A7QBf-n,CDMX,+ACI-http://maps.google.com/maps?q+AD0-loc:19.3511121,-99.178566+ACI-,,,,,,,,,1601,,,,,,Braulio maldonado y Venuztiano carranza,,Casa,Multiples grietas y cuarteaduras en todo el edificio (12 pisos),,,,19.3511121,-99.178566,
92,92,Vito Alessio robles,,+//0A7f/9AIE-lvaro Obreg+//0A7QBf-n,Cdmx,+ACI-http://maps.google.com/maps?q+AD0-loc:19.3522532,-99.1786012+ACI-,,,,,,,,,380,,,,,,NA y NA,,Casa,Da+//0A7f/9ALE-os estructurales en planta baja,,,,19.3522532,-99.1786012,
93,93,Av Toluca,,+//0A7f/9AIE-lvaro Obreg+//0A7QBf-n,Cdmx,+ACI-http://maps.google.com/maps?q+AD0-loc:19.3371347,-99.2333936+ACI-,,,,,,,,,957,,,,,,Olivarito y Mimosa,,,M+//0A7QBf-ltiples grietas por fuera y dentro en los departamentos. Cayeron oedazos de techo y pared. No sabemos si es seguro.,,,,19.3371347,-99.2333936,
94,94,10 (diez),,+//0A7f/9AIE-lvaro Obreg+//0A7QBf-n,CDMX,+ACI-http://maps.google.com/maps?q+AD0-loc:19.3567294,-99.0678913+ACI-,,,,,,,,,21,,,,,,Perif+//0A7f/9AKk-rico y Ferrocarril de Cuernavaca/toltecas,,Edificio de departamentos,Grietas en paredes en edificio residencial de aproximadamente 14 pisos,,,,19.3567294,-99.0678913,
95,95,Insurgentes Sur,,+//0A7f/9AIE-lvaro Obreg+//0A7QBf-n,CDMX,+ACI-http://maps.google.com/maps?q+AD0-loc:19.3571219,-99.1846705+ACI-,,,,,,,,,1799,,,,,,Sobre Bosque de Minas y Pasando el colegio Miraflores,,Departamentos,Grietas y cuarteaduras en paredes y columnas,,,,19.3571219,-99.1846705,
96,96,Calzada de las Aguilas,,+//0A7f/9AIE-LVARO Obreg+//0A7QBf-n,Cdmx,+ACI-http://maps.google.com/maps?q+AD0-loc:19.359619,-99.2068934+ACI-,,,,,,,,,502,,,,,,Torrente y alta tensi+//0A7QBf-n,,,Grietas en paredes de varios departamentos son 4 pisos en total,,,,19.359619,-99.2068934,
97,97,R+//0A7QBf-o Magdalena,,+//0A7f/9AIE-lvaro Obreg+//0A7QBf-n,CDMX,+ACI-http://maps.google.com/maps?q+AD0-loc:19.3377969,-99.1962276+ACI-,,,,,,,,,,,,,,,Triomas y Canosas,,Otro,Hay muchas grietas en todo el Hospital,,,,19.3377969,-99.1962276,
98,98,Av Insurgentes Sur,,+//0A7f/9AIE-lvaro Obreg+//0A7QBf-n,ciudad de mexico,+ACI-http://maps.google.com/maps?q+AD0-loc:19.3610398,-99.1835794+ACI-,,,,,,,,,1685,,,,,,entre barranca del muerto e insurgentes sur,,,muchas grietas en las escaleras de emergencia de lado derecho e izquierdo hay muchas cuarteaduras,,,,19.3610398,-99.1835794,
99,99,Calz. las +//0A7f/9AIE-guilas,,+//0A7f/9AIE-lvaro Obreg+//0A7QBf-n,Ciudad de M+//0A7f/9AKk-xico,+ACI-http://maps.google.com/maps?q+AD0-loc:19.3494047,-99.224867+ACI-,,,,,,,,,1115,,,,,,3ra cerrada de Bah+//0A7QBf-a,,,En mi departamento solo hay unas peque+//0A7f/9ALE-as grietas de yeso. Pero en los otros departamentos parece si se da+//0A7f/9ALE-o peor. No estoy seguro si las estructuras mayores estan da+//0A7f/9ALE-adas  pues no se ven,,,,19.3494047,-99.224867,
100,100,Plaza Roc+//0A7QBf-o,,+//0A7f/9AIE-lvaro Obreg+//0A7QBf-n,Ciudad de M+//0A7f/9AKk-xico,+ACI-http://maps.google.com/maps?q+AD0-loc:19.355784,-99.2342455+ACI-,,,,,,,,,14,,,,,,Avenida Ceylan y Norte 59,,Oficinas,+ACI-grita diagonal por escaleras, y grietas a lo alto de paredes, no se ve ven muy profundas.+ACI-,,,,19.355784,-99.2342455,
101,101,Boulevar Adolfo L+//0A7QBf-pez Mateos,,+//0A7f/9AIE-lvaro Obreg+//0A7QBf-n,Ciudad de M+//0A7f/9AKk-xico,+ACI-http://maps.google.com/maps?q+AD0-loc:19.3715161,-99.1919993+ACI-,,,,,,,,,1661,,,,,,Copilco y Avenida Universidad,,Departamentos,Grietas en los 4 primeros pisos del edificio A6 y los departamentos 4 y 104,,,,19.3715161,-99.1919993,
102,102,Ernest J. Piper,,+//0A7f/9AIE-lvaro Obreg+//0A7QBf-n,Ciudad de M+//0A7f/9AKk-xico,+ACI-http://maps.google.com/maps?q+AD0-loc:19.3693851,-99.2670033+ACI-,,,,,,,,,60,,,,,,Da Vinci y Perif+//0A7f/9AKk-rico,,Departamentos,,,,,19.3693851,-99.2670033,
103,103,Calzada las +//0A7f/9AOc-guilas,,+//0A7f/9AIE-lvaro Obreg+//0A7QBf-n,Ciudad de M+//0A7f/9AKk-xico,+ACI-http://maps.google.com/maps?q+AD0-loc:19.3491812,-99.224844+ACI-,,,,,,,,,1124,,,,,,Fresno y 3cerrada Bah+//0A7QBf-a,,,Grietas y cuartiaduras en paredes del departamento,,,,19.3491812,-99.224844,
104,104,Ernest J. Piper,,+//0A7f/9AIE-lvaro Obreg+//0A7QBf-n,Ciudad de M+//0A7f/9AKk-xico,+ACI-http://maps.google.com/maps?q+AD0-loc:19.3693851,-99.2670033+ACI-,,,,,,,,,60,,,,,,La viga y Eje 5 sur,,Oficinas,,,,,19.3693851,-99.2670033,
105,105,Avenida Centenario,,+//0A7f/9AIE-lvaro Obreg+//0A7QBf-n,Ciudad de M+//0A7f/9AKk-xico,+ACI-http://maps.google.com/maps?q+AD0-loc:19.3664358,-99.2104187+ACI-,,,,,,,,,460  C-2,,,,,,Mej+//0A7QBf-a Delgado y Lomas del +//0A7f/9AIE-ngel,,,Grietas en diferentes paredes y muro decarga de departamento en planta baja.,,,,19.3664358,-99.2104187,
106,106,Paso granite,,+//0A7f/9AIE-lvaro Obreg+//0A7QBf-n,Ciudad de M+//0A7f/9AKk-xico,+ACI-http://maps.google.com/maps?q+AD0-loc:19.3842621,-99.2253908+ACI-,,,,,,,,,926,,,,,,Mexicas y NA,,Otro,Grietas importantes. Mz 9 lt 26,,,,19.3842621,-99.2253908,
107,107,Ernesto J Piper,,+//0A7f/9AIE-lvaro Obreg+//0A7QBf-n,Ciudad de M+//0A7f/9AKk-xico,+ACI-http://maps.google.com/maps?q+AD0-loc:19.3693851,-99.2670033+ACI-,,,,,,,,,60,,,,,,Murillo y Rwnbrant,,Departamentos,Grietas en paredes de departamentos,,,,19.3693851,-99.2670033,
108,108,Av. de las Torres,,+//0A7f/9AIE-lvaro Obreg+//0A7QBf-n,Ciudad de M+//0A7f/9AKk-xico,+ACI-http://maps.google.com/maps?q+AD0-loc:19.3961551,-99.2156968+ACI-,,,,,,,,,131,,,,,,,,,Hay grietas en los edificios,,,,19.3961551,-99.2156968,
109,109,Toltecas 166,,+//0A7f/9AIE-lvaro Obreg+//0A7QBf-n,Ciudad de M+//0A7f/9AKk-xico,,,,,,,,,,Torre B,,,,,,San Antonio y calle 18,,,Grietas en paredes de todos los pisos,,,,,,
110,110,Manzana 4 grupo 3 en la unidad habitacional sta fe,,+//0A7f/9AIE-lvaro Obreg+//0A7QBf-n,M+//0A7f/9AKk-xico D.F.,+ACI-http://maps.google.com/maps?q+AD0-loc:19.3883743,-99.2091517+ACI-,,,,,,,,,2,,,,,,Ferrocarril y NA,,Departamentos,Grietas en la pared,,,,19.3883743,-99.2091517,
111,111,+ACI-Av. Central +ACM-471, edif. 12 depto. 104+ACI-,,+//0A7f/9AIE-lvaro Obreg+//0A7QBf-n,,+ACI-http://maps.google.com/maps?q+AD0-loc:28.9371365,-81.9489465+ACI-,,,,,,,,,471,,,,,,Alvaro Galvez y fuentes y Cerr+//0A7QBf- San Antonio,,Departamentos,Grieta en una parte superior del departamento en la que se aprecia la separacion del ladrillo con la loza,,,,28.9371365,-81.9489465,
112,112,Jacarandas,,+//0A7f/9AIE-lvaro Obreg+//0A7QBf-n,,+ACI-http://maps.google.com/maps?q+AD0-loc:19.3499433,-99.2247715+ACI-,,,,,,,,,141,,,,,,Canal de san juan y Oriente 259,,Departamentos,Leves Cuarteaduras en tres departamentos y una columna,,,,19.3499433,-99.2247715,
113,113,Prolongaci+//0A7QBf-n San Diego,,+//0A7f/9AIE-lvaro Obreg+//0A7QBf-n,,+ACI-http://maps.google.com/maps?q+AD0-loc:19.3321184,-99.2689811+ACI-,,,,,,,,,72,,,,,,Cerritos y San Juanico,,Casa,Grietas de muros,,,,19.3321184,-99.2689811,
114,114,Juborebampo,,+//0A7f/9AIE-lvaro Obreg+//0A7QBf-n,,+ACI-http://maps.google.com/maps?q+AD0-loc:19.3703133,-99.2333569+ACI-,,,,,,,,,18,,,,,,Darwin y V+//0A7QBf-ctor Hugo,,Departamentos,Grietas en la pared del comedor,,,,19.3703133,-99.2333569,
115,115,Fresnos34,,+//0A7f/9AIE-lvaro Obreg+//0A7QBf-n,,+ACI-http://maps.google.com/maps?q+AD0-loc:19.3521663,-99.1985543+ACI-,,,,,,,,,56352533,,,,,,Divisi+//0A7QBf-n de norte y Eje 6,,Departamentos,Aberturas entre escaleras y departamentos,,,,19.3521663,-99.1985543,
116,116,Cerezo mz 27 lt,,+//0A7f/9AIE-lvaro Obreg+//0A7QBf-n,,+ACI-http://maps.google.com/maps?q+AD0-loc:19.3147293,-99.2700187+ACI-,,,,,,,,,68,,,,,,Fernando de Alva Ixtlilxochitl y Cerrada de Fray Servando y Teresa de Mier,,Departamentos,Grietas,,,,19.3147293,-99.2700187,
117,117,Boulevard Adolfo L+//0A7QBf-pez Mateos,,+//0A7f/9AIE-lvaro Obreg+//0A7QBf-n,,+ACI-http://maps.google.com/maps?q+AD0-loc:19.3715161,-99.1919993+ACI-,,,,,,,,,1661,,,,,,Filosof+//0A7QBf-a y Letras y Medicina,,Casa,+ACI-Gritas en los departamentos, las paredes tiene hoyos, se alcanza a ver el exterior+ACI-,,,,19.3715161,-99.1919993,
118,118,Avenida Santa Luc+//0A7QBf-a,,+//0A7f/9AIE-lvaro Obreg+//0A7QBf-n,,+ACI-http://maps.google.com/maps?q+AD0-loc:19.3664682,-99.2319675+ACI-,,,,,,,,,1120,,,,,,NA y NA,,Otro,Es una gruta que est+//0A7f/9AOc- en todo el primer piso,,,,19.3664682,-99.2319675,
