937,937,Av. Baja California,,Cuauht+//0A7f/9AKk-moc,CDMX,+ACI-http://maps.google.com/maps?q+AD0-loc:19.4057595,-99.1668595+ACI-,,,,,,,,,210,,,,,,Av Tlahuac y Altamirano,,Departamentos,+ACI-Da+//0A7f/9ALE-o interior, cuarteaduras, el edificio de a lado es peligroso.+ACI-,,,,19.4057595,-99.1668595,
938,938,Chihuahua,,Cuauht+//0A7f/9AKk-moc,CDMX,+ACI-http://maps.google.com/maps?q+AD0-loc:28.3990198,-106.8605516+ACI-,,,,,,,,,201,,,,,,Av. Santa Fe y Av. Javier Barrios Sierra,,Oficinas,Grietas en parte del edificio.,,,,28.3990198,-106.8605516,
939,939,Avenida M+//0A7f/9AKk-xico,Hipodromo Condesa,Cuauht+//0A7f/9AKk-moc,CDMX,+ACI-https://www.google.com.mx/maps/+AEA-19.4103835,-99.1703739,3a,37.5y,205.14h,82.85t/data+AD0AIQ-3m6+ACE-1e1+ACE-3m4+ACE-1sZOD3Hu4h0e9ISRpTp6WHKw+ACE-2e0+ACE-7i13312+ACE-8i6656+ACI-,,,,01/09/20 18:46,,,,,105,,,,,,Avenida M+//0A7f/9AKk-xico esquina con chilpancingo,,residencial,Edificio desalojado con grandes probabilidades de desplome. Estructura da+//0A7f/9ALE-ada y con fachada cuarteada. Se reporta fuerte olor a Gas.,,,,19.4103835,-99.1703739,
940,940,Praga,,Cuauht+//0A7f/9AKk-moc,Cdmx,+ACI-http://maps.google.com/maps?q+AD0-loc:19.4234823,-99.1689122+ACI-,,,,,,,,,48,,,,,,Azucena y Oriente 185,,Departamentos,+ACI-Ca+//0A7QBf-da de muros superiores, cuarteaduras estructurales, desprendimiento de acabados de fachada, roturas de cristal, desprendimiento de acabados interiores.+ACI-,,,,19.4234823,-99.1689122,
941,941,Calzada San Antonio Abad,Tr+//0A7f/9AOc-nsito,Cuauht+//0A7f/9AKk-moc,CDMX,+ACI-https://www.google.com/maps/place/Ilusi+ACU-C3+ACU-B3n/+AEA-19.4169842,-99.1341179,21z/data+AD0AIQ-4m15+ACE-1m9+ACE-4m8+ACE-1m3+ACE-2m2+ACE-1d-99.1341118+ACE-2d19.4171238+ACE-1m3+ACE-2m2+ACE-1d-99.134118+ACE-2d19.4169578+ACE-3m4+ACE-1s0x0:0x1e68f2136790d712+ACE-8m2+ACE-3d19.4169907+ACE-4d-99.1340851+ACI-,,,,20/09/17,,,,,122,,,,,,Calzada San Antonio Abad y Alfredo Chavero,,oficinas ,Uno de los niveles se colaps+//0A7QBf-. Se requiere valoraci+//0A7QBf-n del edificio. Solo se observan da+//0A7f/9ALE-os materiales. ,,,,19.4168051,-99.1341976,
942,942,Puebla,,Cuauht+//0A7f/9AKk-moc,CDMX,+ACI-http://maps.google.com/maps?q+AD0-loc:19.4235601,-99.1576396+ACI-,,,,,,,,,71,,,,,,Camino a santiaguito y Calle 28B,,Casa,Grietas y el edificio de junto se inclin+//0A7QBf- sobre este,,,,19.4235601,-99.1576396,
943,943,Avenida Chapultepec,,Cuauht+//0A7f/9AKk-moc,Cdmx,+ACI-http://maps.google.com/maps?q+AD0-loc:19.4267919,-99.1511032+ACI-,,,,,,,,,37,,,,,,Cucurpe y Imuris,,Casa,Grietas fuertes en diferentes partes del edificio,,,,19.4267919,-99.1511032,
944,944,M+//0A7f/9AKk-rida,,Cuauht+//0A7f/9AKk-moc,CDMX,+ACI-http://maps.google.com/maps?q+AD0-loc:19.4143165,-99.1561344+ACI-,,,,,,,,,208,,,,,,Diagonal san antonio y Yacatas,,Oficinas,Las grietas del edificio se abrieron m+//0A7f/9AOc-s,,,,19.4143165,-99.1561344,
945,945,rio ebro,,cuauht+//0A7f/9AKk-moc,cdmx,+ACI-http://maps.google.com/maps?q+AD0-loc:19.4324435,-99.1713555+ACI-,,,,,,,,,6,,,,,,Diaz mir+//0A7QBf-n y Sor juana In+//0A7f/9AKk-s,,Departamentos,+ACI-ventanas rotas, paredes completamente cuarteadas, el edificio est+//0A7f/9AOc- recargado en otro+ACI-,,,,19.4324435,-99.1713555,
946,946,Clavijero,,Cuauht+//0A7f/9AKk-moc,Cdmx,+ACI-http://maps.google.com/maps?q+AD0-loc:19.4187505,-99.1297139+ACI-,,,,,,,,,140,,,,,,Dr Liceaga y Dr navarro,,Oficinas,Se derrumb+//0A7QBf- la barda lateral de nuestra casa,,,,19.4187505,-99.1297139,
947,947,Puebla,,Cuauht+//0A7f/9AKk-moc,Cdmx,+ACI-http://maps.google.com/maps?q+AD0-loc:19.4210929,-99.1691105+ACI-,,,,,,,,,282,,,,,,Escollera y +//0A7f/9AI0-nsula,,Departamentos,Derrumbe oficinas farmac+//0A7f/9AKk-utica a+//0A7QBf-n hay gente atrapada,,,,19.4210929,-99.1691105,
948,948,Av. Chapultepec,,Cuauht+//0A7f/9AKk-moc,CDMX,+ACI-http://maps.google.com/maps?q+AD0-loc:19.4214183,-99.1716716+ACI-,,,,,,,,,482,,,,,,Esquina con Cozumel,,,El edificio se inclin+//0A7QBf- sobre el edificio de al lado  tambi+//0A7f/9AKk-n se sienten las escaleras fr+//0A7f/9AOc-giles y hay algunas grietas visibles.,,,,19.4214183,-99.1716716,
949,949,Guerrero,,Cuauht+//0A7f/9AKk-moc,CDMX,+ACI-http://maps.google.com/maps?q+AD0-loc:19.4545819,-99.1456509+ACI-,,,,,,,,,380,,,,,,Flores mag+//0A7QBf-n y eje 2 norte,,,,,,,19.4545819,-99.1456509,
950,950,Almacenes 74  tlatelolco,,Cuauht+//0A7f/9AKk-moc,Cdmx,+ACI-http://maps.google.com/maps?q+AD0-loc:19.4508045,-99.1358887+ACI-,,,,,,,,,Edificio Chihuahua  entrada e,,,,,,Flores magon y reforma,,,Cuarteaduras en los cuartos de ba+//0A7f/9ALE-o de los edificios,,,,19.4508045,-99.1358887,
951,951,Nezahualc+//0A7QBf-yotl,,Cuauht+//0A7f/9AKk-moc,Cdmx,+ACI-http://maps.google.com/maps?q+AD0-loc:19.4699043,-99.0606231+ACI-,,,,,,,,,109,,,,,,Fray Servando  Isabela cat+//0A7QBf-lica  5 de febrero,,,Grandes grietas y cuarteaduras vidrios rotos,,,,19.4699043,-99.0606231,
952,952,Jos+//0A7f/9AKk- Mar+//0A7QBf-a Pino Su+//0A7f/9AOc-rez,,Cuauht+//0A7f/9AKk-moc,Cdmx,+ACI-http://maps.google.com/maps?q+AD0-loc:19.4252033,-99.1334225+ACI-,,,,,,,,,83,,,,,,Izazaga y Nezahualc+//0A7QBf-yotl,,,Grietas y edificio al costado da+//0A7f/9ALE-ado,,,,19.4252033,-99.1334225,
953,953,Chiapas,,Cuauht+//0A7f/9AKk-moc,Cdmx,+ACI-http://maps.google.com/maps?q+AD0-loc:19.4129512,-99.1601439+ACI-,,,,,,,,,99,,,,,,Jalapa y Yucat+//0A7f/9AOc-n,,Edificio,Derrumbe en estructura  paredes  escaleras  inclinaci+//0A7QBf-n  atasco de puertas,,,,19.4129512,-99.1601439,
954,954,Vizcainas,,Cuauht+//0A7f/9AKk-moc,Cdmx,+ACI-http://maps.google.com/maps?q+AD0-loc:19.429112,-99.1409313+ACI-,,,,,,,,,12 int 3,,,,,,L+//0A7f/9AOc-zaro C+//0A7f/9AOc-rdenas y Aldaco,,,1923,,,,19.429112,-99.1409313,
955,955,Paseo de la reforma,,Cuauht+//0A7f/9AKk-moc,CDMX,+ACI-http://maps.google.com/maps?q+AD0-loc:19.433475,-99.1533682+ACI-,,,,,,,,,56,,,,,,Leibnitz y Laplace,,Oficinas,Varias grietas dentro del edificio,,,,19.433475,-99.1533682,
956,956,delicias,,Cuauht+//0A7f/9AKk-moc,cdmx,+ACI-http://maps.google.com/maps?q+AD0-loc:19.4281868,-99.1446768+ACI-,,,,,,,,,58,,,,,,luis moya y buen tono,,,grietas en la superficie de la bomba de agua,,,,19.4281868,-99.1446768,
957,957,Coahuila,,Cuauht+//0A7f/9AKk-moc,CDMX,+ACI-http://maps.google.com/maps?q+AD0-loc:19.4107249,-99.1666779+ACI-,,,,,,,,,223,,,,,,Manzanillo e Insurgentes Sur,,,Al momento del temblor  el edificio vecino choc+//0A7QBf- contra el nuestro. Hay grietas en escaleras y paredes de gran consideraci+//0A7QBf-n.,,,,19.4107249,-99.1666779,
958,958,Sonora,,Cuauht+//0A7f/9AKk-moc,CDMX,+ACI-http://maps.google.com/maps?q+AD0-loc:19.4176131,-99.1714919+ACI-,,,,,,,,,91,,,,,,Mar de los vapores y Mar de la fecundidad,,Casa,+ACI-El edificio presenta grietas en paredes y estructura de escaleras, se percibi+//0A7QBf- fuerte olor a gas pero se cerr+//0A7QBf- el paso del mismo y de igual manera fuga de agua. El edificio de al lado es un hospital que qued+//0A7QBf- desalojado y acordonado.+ACI-,,,,19.4176131,-99.1714919,
959,959,Praga,,Cuauht+//0A7f/9AKk-moc,CDMX,+ACI-http://maps.google.com/maps?q+AD0-loc:19.4236203,-99.1692364+ACI-,,,,,,,,,39,,,,,,,,,Se agregaron las trabes  es decir lo que sostiene al edificio.,,,,19.4236203,-99.1692364,
960,960,Campeche,Condesa,Cuauht+//0A7f/9AKk-moc,CDMX,https://goo.gl/maps/dxt1du7UJVz,,,,20/09/17,,,,,315,,,,,,Nuevo Le+//0A7QBf-n y Citlaltepetl,,oficinas ,A punto del derrumbe,,,,,,
961,961,Vicente Su+//0A7f/9AOc-rez,,Cuauht+//0A7f/9AKk-moc,Cdmx,+ACI-http://maps.google.com/maps?q+AD0-loc:19.4135532,-99.1788088+ACI-,,,,,,,,,123,,,,,,Pachuca y Tula,,,Fisuras y fracturas en muros en varios deptos del edif. Columnas con fisuras,,,,19.4135532,-99.1788088,
962,962,Acapulco,,Cuauht+//0A7f/9AKk-moc,CDMX,+ACI-http://maps.google.com/maps?q+AD0-loc:19.4195588,-99.1742862+ACI-,,,,,,,,,33,,,,,,Palmas y Castillo de Windsor,,Departamentos,+ACI-Se cay+//0A7QBf- fachada, da+//0A7f/9ALE-os graves en cada piso. Ya no es habitable.+ACI-,,,,19.4195588,-99.1742862,
963,963,Edison,,Cuauht+//0A7f/9AKk-moc,CDMX,+ACI-http://maps.google.com/maps?q+AD0-loc:19.4375729,-99.1542981+ACI-,,,,,,,,,91,,,,,,Rio churubusco y Eje 8 sur,,Casa,+ACI-Grietas en departamentos, fachada y muros de carga+ACI-,,,,19.4375729,-99.1542981,
964,964,Dr. Andrade,,Cuauht+//0A7f/9AKk-moc,CDMX,+ACI-http://maps.google.com/maps?q+AD0-loc:19.4266474,-99.1443421+ACI-,,,,,,,,,14,,,,,,R+//0A7QBf-o de la Loza y Arcos de Bel+//0A7f/9AKk-n,,,Se levant+//0A7QBf- el piso  en pasillo frente a jard+//0A7QBf-n  yendo hac+//0A7QBf-a H101,,,,19.4266474,-99.1443421,
965,965,R+//0A7QBf-o Tiber,,Cuauht+//0A7f/9AKk-moc,Cdmx,+ACI-http://maps.google.com/maps?q+AD0-loc:19.4290221,-99.1689672+ACI-,,,,,,,,,99,,,,,,R+//0A7QBf-o Lerma y R+//0A7QBf-o P+//0A7f/9AOc-nuco,,,Derrumbe es escaleras Internas del 6 al 11vo piso  grietas profundas longitudinales en el centro de los muros de cargas,,,,19.4290221,-99.1689672,
966,966,Manuel Mar+//0A7QBf-a Contreras,,Cuauht+//0A7f/9AKk-moc,CDMX,+ACI-http://maps.google.com/maps?q+AD0-loc:19.4407432,-99.1641722+ACI-,,,,,,,,,30,,,,,,Rio Nazas y NA,,Departamentos,+ACI-Gritas en el s+//0A7QBf-tano del edifico qu+//0A7f/9AKk- funciona como estacionamiento y una columna de soporte se separ+//0A7QBf- como 2cm de la pared qu+//0A7f/9AKk- ten+//0A7QBf-a a lado y grietas en departamentos

+ACI-,,,,19.4407432,-99.1641722,
967,967,Huatabampo,,Cuauht+//0A7f/9AKk-moc,CDMX,+ACI-http://maps.google.com/maps?q+AD0-loc:19.4073643,-99.1553805+ACI-,,,,,,,,,6,,,,,,Roque Velasco ceron y Camino real a Toluca,,Casa,+ACI-Grandes grietas y da+//0A7f/9ALE-o estructural en todo el edificio. Escaleras agrietadas. Paredes da+//0A7f/9ALE-adas en pisos inferiores, s+//0A7QBf-tano da+//0A7f/9ALE-ado.+ACI-,,,,19.4073643,-99.1553805,
968,968,Doctor Atl,,Cuauht+//0A7f/9AKk-moc,Cdmx,+ACI-http://maps.google.com/maps?q+AD0-loc:19.4434238,-99.1572181+ACI-,,,,,,,,,65,,,,,,San Francisco y Fresas,,Departamentos,+ACI-Grieta en la sala, no sabemos c+//0A7QBf-mo evaluar la situaci+//0A7QBf-n o si tenemos que desalojar. Gracias+ACI-,,,,19.4434238,-99.1572181,
969,969,Cerrada de londres,,Cuauht+//0A7f/9AKk-moc,Cdmx,+ACI-http://maps.google.com/maps?q+AD0-loc:19.4281856,-99.1578307+ACI-,,,,,,,,,14,,,,,,Toledo y sevilla,,,Las dos medianeras del edificio se saltaron. Dicen vecinos que ven que el edificio esta recargandose sobre otro,,,,19.4281856,-99.1578307,
970,970,Colima,,Cuauht+//0A7f/9AKk-moc,CDMX,+ACI-http://maps.google.com/maps?q+AD0-loc:19.4191377,-99.1621563+ACI-,,,,,,,,,220,,,,,,Tonal+//0A7f/9AOc- y Jalapa,,,Edificio afectado  descartar si se derrumbar+//0A7f/9AOc- o es habitable,,,,19.4191377,-99.1621563,
971,971,Av. Viaducto Miguel Alem+//0A7f/9AOc-n,,Cuauht+//0A7f/9AKk-moc,CDMX,+ACI-http://maps.google.com/maps?q+AD0-loc:19.4042201,-99.1515173+ACI-,,,,,,,,,157,,,,,,V+//0A7f/9AKk-rtiz y Viaducto,,,Grietas a 45+//0AjP/9AME-,,,,19.4042201,-99.1515173,
972,972,Roma,,Cuauht+//0A7f/9AKk-moc,Cdmx,+ACI-http://maps.google.com/maps?q+AD0-loc:19.4295526,-99.1576791+ACI-,,,,,,,,,33,,,,,,Viena,,,,,,,19.4295526,-99.1576791,
973,973,Calle de Balderas,Centro,Cuauht+//0A7f/9AKk-moc,CDMX,+ACI-https://www.google.com.mx/maps/place/Scientology+//0AJQ-C3+ACU-A9xico+Centro+Hisv//QAl-C3+ACU-B3rico/+AEA-19.4354669,-99.1473997,15z/data+AD0AIQ-4m2+ACE-3m1+ACE-1s0x0:0x7375edbdb3960319?sa+AD0-X+ACY-ved+AD0-0ahUKEwik1JSVv7XWAhVJilQKHecOAsIQ+AF8-BIIhQEwDw+ACI-,,,,20/09/17,Ayuda para rertirar escombros,,,,27,,,,,,,,Balderas 27,Derrumbe,,,,,,
974,974,R+//0A7QBf-o Balsas,,Cuauht+//0A7f/9AKk-moc,+ACI-CDMX, Col. Cuahutemoc+ACI-,+ACI-http://maps.google.com/maps?q+AD0-loc:19.4323454,-99.169873+ACI-,,,,,,,,,78,,,,,,Laguna de Mayran y Laguna de T+//0A7f/9AKk-rminos,,Departamentos,+ACI-En los descansos de los departamentos se ven las paredes abultadas, como si se hubieran salido de su lugar. Grietas en techos y paredes.+ACI-,,,,19.4323454,-99.169873,
975,975,Av Tamaulipas,,Cuauht+//0A7f/9AKk-moc,+ACI-CDMX, Colonia Condesa+ACI-,+ACI-http://maps.google.com/maps?q+AD0-loc:19.4066914,-99.1789061+ACI-,,,,,,,,,236,,,,,,Chilpancingo y Iztacc+//0A7QBf-huatl,,Departamentos,+ACI-Grietas diagonales, horizontales y verticales atravesando muros+ACI-,,,,19.4066914,-99.1789061,
976,976,Sinaloa,,Cuauht+//0A7f/9AKk-moc,Cdmx. Col Roma Norte,+ACI-http://maps.google.com/maps?q+AD0-loc:19.4201946,-99.1692447+ACI-,,,,,,,,,120,,,,,,Salamanca y Valladolid,,,Fachada con desprendimiento de yeso  al interior muchas grietas en muros  al centro del cubo de escaleras se ve muro doblado como si la viga de adentro estuviera torcida,,,,19.4201946,-99.1692447,
977,977,Juan escutia,,Cuauht+//0A7f/9AKk-moc,Ciudad,+ACI-http://maps.google.com/maps?q+AD0-loc:19.4148347,-99.1752469+ACI-,,,,,,,,,66,,,,,,Padeo del rio y Rio churubusco,,Departamentos,,,,,19.4148347,-99.1752469,
978,978,avenida Manuel gonzalez,,Cuauht+//0A7f/9AKk-moc,ciudad d M+//0A7f/9AKk-xico,+ACI-http://maps.google.com/maps?q+AD0-loc:19.4561945,-99.1458531+ACI-,,,,,,,,,372-1-202,,,,,,eje 1 poniente y av insurgentes norte,,,Tres grietas en muro de departamento,,,,19.4561945,-99.1458531,
979,979,M+//0A7f/9AKk-rida,,Cuauht+//0A7f/9AKk-moc,Ciudad de M+//0A7f/9AKk-xcico,+ACI-http://maps.google.com/maps?q+AD0-loc:19.4122306,-99.1558146+ACI-,,,,,,,,,245B,,,,,,Antonio M. Anza y Coahuila,,,Es una casa de dos pisos  con grietas en el techo del segundo piso y gritas profundas en paredes que van del techo del segundo piso a la planta baja. Se observa da+//0A7f/9ALE-o en ladrillos  m+//0A7f/9AOc-s all+//0A7f/9AOc- de la ca+//0A7QBf-da de la cobertura de yeso.,,,,19.4122306,-99.1558146,
980,980,Dr velasco,,Cuauht+//0A7f/9AKk-moc,Ciudad de mexico,+ACI-http://maps.google.com/maps?q+AD0-loc:19.4191949,-99.1491826+ACI-,,,,,,,,,96,,,,,,Desierto de los leones y Colina,,Departamentos,Grietas en escaleras y departamento del 5 piso,,,,19.4191949,-99.1491826,
981,981,Cozumel,,Cuauht+//0A7f/9AKk-moc,Ciudad de Mexico,+ACI-http://maps.google.com/maps?q+AD0-loc:19.4184116,-99.1707314+ACI-,,,,,,,,,52,,,,,,Durango y cerrada de Salamanca,,,Derrumbe de la fachada y grietas,,,,19.4184116,-99.1707314,
982,982,Republica de Venezuela,,Cuauht+//0A7f/9AKk-moc,Ciudad de Mexico,+ACI-http://maps.google.com/maps?q+AD0-loc:19.4371769,-99.1304849+ACI-,,,,,,,,,35,,,,,,El Carmen y Republica de Argentina,,,Grietas inclinadas en varias partes del edificio habitacional. Pilares cuarteados  puertas y ventanas atoradas  escalerillas afectadas.,,,,19.4371769,-99.1304849,
983,983,Gumercindo Esquer,,Cuauht+//0A7f/9AKk-moc,Ciudad de Mexico,+ACI-http://maps.google.com/maps?q+AD0-loc:19.4069089,-99.1331671+ACI-,,,,,,,,,71,,,,,,Jos+//0A7f/9AKk- Mar+//0A7QBf-a Correa/Ram+//0A7QBf-n Fabie,,,Grietas en las escaleras en los 4 pisos  las escaleras unen dos bloques de departamentos.,,,,19.4069089,-99.1331671,
984,984,Magnolia,,Cuauht+//0A7f/9AKk-moc,Ciudad de Mexico,+ACI-http://maps.google.com/maps?q+AD0-loc:19.4425364,-99.1430601+ACI-,,,,,,,,,72,,,,,,Lerdo y Soto,,Edificio aparentemente abandonado,Desprendimiento parcial de la fachada aplastando 4 veh+//0A7QBf-culos estacionados se desconoce si hay derrumbes dentro y si estaba habitado pero al parecer vecinos indican que no,,,,19.4425364,-99.1430601,
985,985,Tokio,,Cuauht+//0A7f/9AKk-moc,Ciudad de Mexico,+ACI-http://maps.google.com/maps?q+AD0-loc:19.4242444,-99.1705785+ACI-,,,,,,,,,18 bis,,,,,,Praga y Av. Sevilla,,,Grieta a mitad de la pared  cubre  de techo a piso,,,,19.4242444,-99.1705785,
986,986,Rio Guadalquivir,,Cuauht+//0A7f/9AKk-moc,Ciudad de mexico,+ACI-http://maps.google.com/maps?q+AD0-loc:19.4290361,-99.1705578+ACI-,,,,,,,,,61,,,,,,Rio panuco y rio lerma,,,Grietas significativas ventanas rotas,,,,19.4290361,-99.1705578,
987,987,Diagonal 20 de noviembre,,Cuauht+//0A7f/9AKk-moc,Ciudad de M+//0A7f/9AKk-xico,+ACI-http://maps.google.com/maps?q+AD0-loc:19.4230836,-99.1351227+ACI-,,,,,,,,,219,,,,,,5 de febrero,,,Muchas grietas y un edificio m+//0A7f/9AOc-s da+//0A7f/9ALE-ado al lado que influy+//0A7QBf- para que se lastimara el edificio antes mencionado,,,,19.4230836,-99.1351227,
988,988,Estrasburgo,,Cuauht+//0A7f/9AKk-moc,Ciudad de M+//0A7f/9AKk-xico,+ACI-http://maps.google.com/maps?q+AD0-loc:19.4265287,-99.1654558+ACI-,,,,,,,,,30,,,,,,Amberes y Genova,,,Severas cuarteaduras y vidrios reventados.,,,,19.4265287,-99.1654558,
989,989,Humboldt,,Cuauht+//0A7f/9AKk-moc,Ciudad de M+//0A7f/9AKk-xico,+ACI-http://maps.google.com/maps?q+AD0-loc:19.433229,-99.1485344+ACI-,,,,,,,,,56,,,,,,Art+//0A7QBf-culo 123 y balderas,,,Cuartea duras en edificio escaleras inestables,,,,19.433229,-99.1485344,
990,990,Florencia,,Cuauht+//0A7f/9AKk-moc,Ciudad de M+//0A7f/9AKk-xico,+ACI-http://maps.google.com/maps?q+AD0-loc:19.4254876,-99.1668053+ACI-,,,,,,,,,37,,,,,,Augusto Rodin y Juan Cordero,,Departamentos,Grietas en las paredes de las escaleras,,,,19.4254876,-99.1668053,
991,991,Revillagigedo,,Cuauht+//0A7f/9AKk-moc,Ciudad de M+//0A7f/9AKk-xico,+ACI-http://maps.google.com/maps?q+AD0-loc:19.4343038,-99.1457598+ACI-,,,,,,,,,18,,,,,,Av Ju+//0A7f/9AOc-rez e Independencia,,,Es un edificio de 800 departamentos y tiene grietas en pasillos en PB y entradas es impresionante  por favor vengan SOS,,,,19.4343038,-99.1457598,
992,992,Nuevo Le+//0A7QBf-n,,Cuauht+//0A7f/9AKk-moc,Ciudad de M+//0A7f/9AKk-xico,+ACI-http://maps.google.com/maps?q+AD0-loc:19.4037446,-99.1708897+ACI-,,,,,,,,,240,,,,,,Bahia de concepcion y Bahia de todos los santos,,Departamentos,Se habrieron grietas estructurales importantes en varios cuartos.Hubo fuga de gas.,,,,19.4037446,-99.1708897,
993,993,Nuevo leon,,Cuauht+//0A7f/9AKk-moc,Ciudad de M+//0A7f/9AKk-xico,+ACI-http://maps.google.com/maps?q+AD0-loc:19.4061392,-99.1715851+ACI-,,,,,,,,,192,,,,,,Baja California y tlaxcala,,,Grietas en columnas  muros  cristales rotos,,,,19.4061392,-99.1715851,
994,994,Nuevo Le+//0A7QBf-n,,Cuauht+//0A7f/9AKk-moc,Ciudad de M+//0A7f/9AKk-xico,+ACI-http://maps.google.com/maps?q+AD0-loc:19.4061392,-99.1715851+ACI-,,,,,,,,,192,,,,,,Baja California y tlaxcala,,,Vidrios rotos  grietas  pared rota  escaleras,,,,19.4061392,-99.1715851,
995,995,Guadalquivir,,Cuauht+//0A7f/9AKk-moc,Ciudad de M+//0A7f/9AKk-xico,+ACI-http://maps.google.com/maps?q+AD0-loc:19.4292751,-99.1705033+ACI-,,,,,,,,,,,,,,,Bol+//0A7QBf-var y Eje Central,,Casa,,,,,19.4292751,-99.1705033,
996,996,Santa Mar+//0A7QBf-a La Ribera,,Cuauht+//0A7f/9AKk-moc,Ciudad de M+//0A7f/9AKk-xico,+ACI-http://maps.google.com/maps?q+AD0-loc:19.4461322,-99.1572835+ACI-,,,,,,,,,97,,,,,,Bosques de Roma y Blvrd. Prados de Arag+//0A7QBf-n,,Casa,Grietas en ventanas,,,,19.4461322,-99.1572835,
997,997,5 de February 0132,,Cuauht+//0A7f/9AKk-moc,Ciudad de M+//0A7f/9AKk-xico,+ACI-http://maps.google.com/maps?q+AD0-loc:19.4232912,-99.1355194+ACI-,,,,,,,,,132,,,,,,Bravo y NA,,Casa,Grietas en paredes dentro de los 2 edifici,,,,19.4232912,-99.1355194,
998,998,jose Joaqu+//0A7QBf-n pesado,,Cuauht+//0A7f/9AKk-moc,ciudad de M+//0A7f/9AKk-xico,+ACI-http://maps.google.com/maps?q+AD0-loc:19.412247,-99.1367701+ACI-,,,,,,,,,5,,,,,,Calle 16 y Calle 18,,Comercio,Grietas y derrumbe de una barda,,,,19.412247,-99.1367701,
999,999,Xocongo,,Cuauht+//0A7f/9AKk-moc,Ciudad de M+//0A7f/9AKk-xico,+ACI-http://maps.google.com/maps?q+AD0-loc:19.4217883,-99.1311115+ACI-,,,,,,,,,225,,,,,,Callej+//0A7QBf-n San Antonio Abad y Chimalpopoca,,,Grietas tanto en exterior como en interior,,,,19.4217883,-99.1311115,
1000,1000,Insurgentes sur,,Cuauht+//0A7f/9AKk-moc,Ciudad de M+//0A7f/9AKk-xico,+ACI-http://maps.google.com/maps?q+AD0-loc:19.408827,-99.1672892+ACI-,,,,,,,,,402,,,,,,Campeche y aguas calientes,,,Cuarteaduras al frente y espamdas de la estructura,,,,19.408827,-99.1672892,
1001,1001,Niza,,Cuauht+//0A7f/9AKk-moc,Ciudad de M+//0A7f/9AKk-xico,+ACI-http://maps.google.com/maps?q+AD0-loc:19.424368,-99.1614732+ACI-,,,,,,,,,81,,,,,,Chapultepec y Liverpool,,,Grietas en muros (columnas sin da+//0A7f/9ALE-os visibles),,,,19.424368,-99.1614732,
1002,1002,Calz. La viga,,Cuauht+//0A7f/9AKk-moc,Ciudad de M+//0A7f/9AKk-xico,+ACI-http://maps.google.com/maps?q+AD0-loc:19.4214731,-99.1274788+ACI-,,,,,,,,,9,,,,,,Chimalpopoca y Fray Servando,,,Varios postes de luz de concreto y madera se ladearon  provocando grietas leves en las banquetas y algunas l+//0A7f/9AOc-mparas que se calleron.,,,,19.4214731,-99.1274788,
1003,1003,Antonio sola,,Cuauht+//0A7f/9AKk-moc,Ciudad de M+//0A7f/9AKk-xico,+ACI-http://maps.google.com/maps?q+AD0-loc:19.4150743,-99.1739222+ACI-,,,,,,,,,38-3,,,,,,Cuernavaca y Atlixco,,,Coarteaduras en varias paredes y techos,,,,19.4150743,-99.1739222,
1004,1004,5 de February 0132,,Cuauht+//0A7f/9AKk-moc,Ciudad de M+//0A7f/9AKk-xico,+ACI-http://maps.google.com/maps?q+AD0-loc:19.4232912,-99.1355194+ACI-,,,,,,,,,132,,,,,,Edificio 9 y Edificio 11,,Departamentos,Grietas en paredes dentro de los 2 edifici,,,,19.4232912,-99.1355194,
1005,1005,R+//0A7QBf-o Ussuri,,Cuauht+//0A7f/9AKk-moc,Ciudad de M+//0A7f/9AKk-xico,+ACI-http://maps.google.com/maps?q+AD0-loc:19.4347711,-99.1691058+ACI-,,,,,,,,,33,,,,,,Eje Central Lazaro Cardenas y Ogazon,,Departamentos,Grietas en departamentos y techos. Pasamanos vencidos. Sin luz desde el sismo.,,,,19.4347711,-99.1691058,
1006,1006,Miguel Schultz,,Cuauht+//0A7f/9AKk-moc,Ciudad de M+//0A7f/9AKk-xico,+ACI-http://maps.google.com/maps?q+AD0-loc:19.4392393,-99.1603992+ACI-,,,,,,,,,47,,,,,,Esquina con Alfonso Herrera,,,El edificio ya ten+//0A7QBf-a da+//0A7f/9ALE-os estructurales desde el sismo del 85  supuestamente le realizaron reforzamientos pero sufri+//0A7QBf- nuevos da+//0A7f/9ALE-os bastante severos,,,,19.4392393,-99.1603992,
1007,1007,Clavijero,,Cuauht+//0A7f/9AKk-moc,Ciudad de M+//0A7f/9AKk-xico,+ACI-http://maps.google.com/maps?q+AD0-loc:19.4187505,-99.1297139+ACI-,,,,,,,,,140,,,,,,Esquina Soquipa,,,Derrumbe de construcci+//0A7QBf-n al interior de la casa y barda que da a la calle.,,,,19.4187505,-99.1297139,
1008,1008,Zacatecas,,Cuauht+//0A7f/9AKk-moc,Ciudad de M+//0A7f/9AKk-xico,+ACI-http://maps.google.com/maps?q+AD0-loc:19.416655,-99.154946+ACI-,,,,,,,,,6,,,,,,Frontera y Avenida Cuauht+//0A7f/9AKk-moc,,Campamento,De una pared que qued+//0A7QBf- de un edificio que se derrumb+//0A7QBf- en +//0A7f/9AKk-ste predio  se desgajaron algunos tabiques  el temor es que caigan m+//0A7f/9AOc-s y nuestra vivienda tiene techo de l+//0A7f/9AOc-mina y al caer podr+//0A7QBf-a da+//0A7f/9ALE-ar nuestra vivienda o a alguien m+//0A7f/9AOc-s. No nos tomen como prioridad porque hay gente que lo necesita m+//0A7f/9AOc-s  pero por favor cuando tengan un tiempo ojal+//0A7f/9AOc- nos puedan visitar para evaluar el caso y ayudarnos. Gracias,,,,19.416655,-99.154946,
1009,1009,Plaza Santos Degollado,,Cuauht+//0A7f/9AKk-moc,Ciudad de M+//0A7f/9AKk-xico,+ACI-http://maps.google.com/maps?q+AD0-loc:19.4328981,-99.1434597+ACI-,,,,,,,,,10,,,,,,Independencia y art+//0A7QBf-culo 123,,,Varias grietas en paredes y piedras callendo a la calle edificio de 11 pisos,,,,19.4328981,-99.1434597,
1010,1010,Nezahualc+//0A7QBf-yotl,,Cuauht+//0A7f/9AKk-moc,Ciudad de M+//0A7f/9AKk-xico,+ACI-http://maps.google.com/maps?q+AD0-loc:19.4699043,-99.0606231+ACI-,,,,,,,,,109,,,,,,Isabel la Cat+//0A7QBf-lica y 5 de febrero,,,Somos vecinos de Isabel la Cat+//0A7QBf-lica 116 y la parte trasera del edificio de Sacmex (muy da+//0A7f/9ALE-ada  llena de grietas y peque+//0A7f/9ALE-os desprendimientos )  da justo hacia nuestra unidad  queremos que vengan a evaluar el da+//0A7f/9ALE-o y saber si representa un peligro para nosotros,,,,19.4699043,-99.0606231,
1011,1011,Manuel Payno,,Cuauht+//0A7f/9AKk-moc,Ciudad de M+//0A7f/9AKk-xico,+ACI-http://maps.google.com/maps?q+AD0-loc:19.4140702,-99.1397248+ACI-,,,,,,,,,86,,,,,,Isabel la Cat+//0A7QBf-lica y Bolivar,,,Edificio viejo grietas afuera y dentro de los departamentos  desprendimiento de partes del concreto.,,,,19.4140702,-99.1397248,
1012,1012,Varsovia,,Cuauht+//0A7f/9AKk-moc,Ciudad de M+//0A7f/9AKk-xico,+ACI-http://maps.google.com/maps?q+AD0-loc:19.424555,-99.1677457+ACI-,,,,,,,,,36,,,,,,Londres y Hamburgo,,,,,,,19.424555,-99.1677457,
1013,1013,Articulo 123-,,Cuauht+//0A7f/9AKk-moc,CIUDAD DE M+//0A7f/9AKk-xico,+ACI-http://maps.google.com/maps?q+AD0-loc:19.4325581,-99.1454769+ACI-,,,,,,,,,62,,,,,,Luis Moya y Revillagigedo,,Edificio 5 pisos,Inclinaci+//0A7QBf-n muy fuerte hacia la parte norte,,,,19.4325581,-99.1454769,
1014,1014,Guerrero,,Cuauht+//0A7f/9AKk-moc,Ciudad de M+//0A7f/9AKk-xico,+ACI-http://maps.google.com/maps?q+AD0-loc:19.4430704,-99.1477596+ACI-,,,,,,,,,107,,,,,,Magnolia y Pedro Moreno,,Cl+//0A7QBf-nica La Prensa,Grietas y derrumbes parciales al interior de la cl+//0A7QBf-nica. Inestabilidad del edificio.,,,,19.4430704,-99.1477596,
1015,1015,Insurgentes Sur,,Cuauht+//0A7f/9AKk-moc,Ciudad de M+//0A7f/9AKk-xico,+ACI-http://maps.google.com/maps?q+AD0-loc:19.4117878,-99.1663948+ACI-,,,,,,,,,348,,,,,,Manzanillo y Chiapas,,9 pisos oficinas  comercios y mixtos,Edificio de los a+//0A7f/9ALE-os 50  previamente parcialmente da+//0A7f/9ALE-ado en 1985  el edificio presenta derrumbes parciales en el interior  grietas amplias estructurales horizontales  verticales e inclinadas  en el exterior se puede apreciar que el edificio se encuentra inclinado hacia la calle de Manzanillo.,,,,19.4117878,-99.1663948,
1016,1016,Antonio Sola,,Cuauht+//0A7f/9AKk-moc,Ciudad de M+//0A7f/9AKk-xico,+ACI-http://maps.google.com/maps?q+AD0-loc:19.4157601,-99.175523+ACI-,,,,,,,,,72,,,,,,Mazatlan y Cuernavaca,,,Grietas grandes vistas desde fachada  separaci+//0A7QBf-n de muros,,,,19.4157601,-99.175523,
1017,1017,Coahuila,,Cuauht+//0A7f/9AKk-moc,Ciudad de M+//0A7f/9AKk-xico,+ACI-http://maps.google.com/maps?q+AD0-loc:19.4124359,-99.1564009+ACI-,,,,,,,,,30,,,,,,M+//0A7f/9AKk-rida y cordoba,,,Grietas en el edificio,,,,19.4124359,-99.1564009,
1018,1018,Paseo de la Reforma,,Cuauht+//0A7f/9AKk-moc,Ciudad de M+//0A7f/9AKk-xico,+ACI-http://maps.google.com/maps?q+AD0-loc:19.4310073,-99.1607402+ACI-,,,,,,,,,175,,,,,,,,,Grietas en todos los pisos,,,,19.4310073,-99.1607402,
1019,1019,Colima,,Cuauht+//0A7f/9AKk-moc,Ciudad de M+//0A7f/9AKk-xico,+ACI-http://maps.google.com/maps?q+AD0-loc:19.4186039,-99.164932+ACI-,,,,,,,,,280,,,,,,,,,Grietas en todo el departamento. En esquinas y Marcos de puertas,,,,19.4186039,-99.164932,
