1483,1483,Lago guija,,Miguel Hidalgo,Ciudad de Mexico,+ACI-http://maps.google.com/maps?q+AD0-loc:19.4583143,-99.1920677+ACI-,,,,,,,,,72,,,,,,Progreso y P+//0A7f/9AKk-rez valenzuela,,Otro,Grietas. En muros. Y columnas de carga,,,,19.4583143,-99.1920677,
1484,1484,lago cuitzeo,,miguel hidalgo,ciudad de mexico,+ACI-http://maps.google.com/maps?q+AD0-loc:19.4477958,-99.1735467+ACI-,,,,,,,,,32,,,,,,san francisco y patricui sainz,,Departamentos,grietas en una viga importante de la  construccion,,,,19.4477958,-99.1735467,
1485,1485,13 de septiembre,,Miguel Hidalgo,Ciudad de M+//0A7f/9AKk-xico,+ACI-http://maps.google.com/maps?q+AD0-loc:19.3990723,-99.1787061+ACI-,,,,,,,,,88,,,,,,12 de diciembre y 28 de agosto,,Vecindad,Apoyo para verificar vecindad habitaci+//0A7QBf-n ubicada calle 13 de septiembre +ACM-88 como referencia la pulquer+//0A7QBf-a la pirata la vecindad incluye la pulquer+//0A7QBf-a se notan varias grietas en pared de habitaci+//0A7QBf-n superior adem+//0A7f/9AOc-s de grieta en la tortilleria a un costado de la pulquer+//0A7QBf-a incluso dentro del inmueble en escaleras y habitaciones de los inquilinos no se reporta a la brevedad ya que due+//0A7f/9ALE-o de la pulquer+//0A7QBf-a teme que cierren su negocio apoyo a la brevedad posible se detecta tambi+//0A7f/9AKk-n una separaci+//0A7QBf-n entre la vecindad y un edificio aleda+//0A7f/9ALE-o Se menciona tambi+//0A7f/9AKk-n que en la azotea del inmueble hay un tanque de gas que abastece a la tortilleria indicando que no se ha cambiado desde hace 23 a+//0A7f/9ALE-os solo se ha pintado y temen por su vida,,,,19.3990723,-99.1787061,
1486,1486,Cuitzeo,,Miguel Hidalgo,Ciudad de M+//0A7f/9AKk-xico,+ACI-http://maps.google.com/maps?q+AD0-loc:19.4477958,-99.1735467+ACI-,,,,,,,,,32,,,,,,24 sur y Avenida san Manuel,,Departamentos,Nuevas grietas e incremento de fisuras de los muros de soporte de estructuras.,,,,19.4477958,-99.1735467,
1487,1487,Mutualismo,,Miguel Hidalgo,Ciudad de M+//0A7f/9AKk-xico,+ACI-http://maps.google.com/maps?q+AD0-loc:19.4012278,-99.1727798+ACI-,,,,,,,,,79,,,,,,Agrarismo y Sindicalismo.,,,Muchas grietas en los departamentos de abajo  en paredes y en algunas columnas.,,,,19.4012278,-99.1727798,
1488,1488,Shakespeare,,Miguel Hidalgo,Ciudad de M+//0A7f/9AKk-xico,+ACI-http://maps.google.com/maps?q+AD0-loc:19.4273801,-99.1764974+ACI-,,,,,,,,,39,,,,,,Amado Paniagua y Jose Rivera,,Departamentos,+ACI-En escaleras y sitios de trabajo se aprecian gritas en diagonal, en partes es visible el ladrillo, durante el sismo el edificio se tallo con el de al lado y g+//0A7f/9AKk-nero escombros, piden que se labore normalmente.+ACI-,,,,19.4273801,-99.1764974,
1489,1489,Quetzalcoatl,,Miguel Hidalgo,Ciudad de M+//0A7f/9AKk-xico,+ACI-http://maps.google.com/maps?q+AD0-loc:19.4402642,-99.1686647+ACI-,,,,,,,,,64,,,,,,Blvd. De los  guerreros y Ignacio zaragoza,,Comercio,Grietas en el techo visibles y pedazos abiertos a la interperie,,,,19.4402642,-99.1686647,
1490,1490,+ACI-Kelvin 27, Anz+//0A7QBf-rez, 11590 Ciudad de M+//0A7f/9AKk-xico, CDMX+ACI-,,Miguel Hidalgo,Ciudad de M+//0A7f/9AKk-xico,+ACI-http://maps.google.com/maps?q+AD0-loc:19.4346591,-99.1811015+ACI-,,,,,,,,,27,,,,,,Darwin y NA,,Departamentos,+ACI-Grietas en gran magnitud, en el interior del edificio.+ACI-,,,,19.4346591,-99.1811015,
1491,1491,Schiller,,Miguel Hidalgo,Ciudad de M+//0A7f/9AKk-xico,+ACI-http://maps.google.com/maps?q+AD0-loc:19.4363091,-99.1862711+ACI-,,,,,,,,,138,,,,,,Ej+//0A7f/9AKk-rcito nacional y Homero,,,Agrietado,,,,19.4363091,-99.1862711,
1492,1492,Golfo de M+//0A7f/9AKk-xico,,Miguel Hidalgo,Ciudad de M+//0A7f/9AKk-xico,+ACI-http://maps.google.com/maps?q+AD0-loc:19.4563655,-99.1878346+ACI-,,,,,,,,,31,,,,,,Francisco Fern+//0A7f/9AOc-ndez del Castillo y Laura,,Departamentos,+ACI-Grietas, edificio viejo. Sobrevivi+//0A7QBf- al terremoto del 85.+ACI-,,,,19.4563655,-99.1878346,
1493,1493,Emerson,,Miguel Hidalgo,Ciudad de M+//0A7f/9AKk-xico,+ACI-http://maps.google.com/maps?q+AD0-loc:19.436442,-99.188704+ACI-,,,,,,,,,140,,,,,,Homero y ej+//0A7f/9AKk-rcito nacional,,,Grietas paralelas caso del techo al piso en el s+//0A7f/9AKk-ptimo piso y algunas menores en otrosnpisos,,,,19.436442,-99.188704,
1494,1494,Felipe Carrillo puerto,,Miguel Hidalgo,Ciudad de M+//0A7f/9AKk-xico,+ACI-http://maps.google.com/maps?q+AD0-loc:19.4538539,-99.1939792+ACI-,,,,,,,,,603,,,,,,Lago taulebe y lago atter,,,Agrietado,,,,19.4538539,-99.1939792,
1495,1495,Av.Felipe Carrillo Puerto,,Miguel Hidalgo,Ciudad de M+//0A7f/9AKk-xico,+ACI-http://maps.google.com/maps?q+AD0-loc:19.449813,-99.1795224+ACI-,,,,,,,,,210,,,,,,Lago T+//0A7QBf-nez y lago Texcoco,,,Grietas ocasionadas por el temblor y ca+//0A7QBf-da de elevadores,,,,19.449813,-99.1795224,
1496,1496,Shakespeare,,Miguel hidalgo,Ciudad de M+//0A7f/9AKk-xico,+ACI-http://maps.google.com/maps?q+AD0-loc:19.4273777,-99.1764945+ACI-,,,,,,,,,39,,,,,,Laguna del Carmen y Laguna de Tamiahua,,Departamentos,Grietas y edificio ladeado,,,,19.4273777,-99.1764945,
1497,1497,Horacio,,Miguel Hidalgo,Ciudad de M+//0A7f/9AKk-xico,+ACI-http://maps.google.com/maps?q+AD0-loc:19.4335738,-99.1874065+ACI-,,,,,,,,,401,,,,,,Lope de vega y Hegel,,,Numerosas grietas,,,,19.4335738,-99.1874065,
1498,1498,Ibarbourou,,Miguel Hidalgo,Ciudad de M+//0A7f/9AKk-xico,+ACI-http://maps.google.com/maps?q+AD0-loc:19.4323116,-99.1874181+ACI-,,,,,,,,,402 501,,,,,,Lope de Vega y Hegel,,,Grietas en paredes,,,,19.4323116,-99.1874181,
1499,1499,Laguna de Mayran,,Miguel Hidalgo,Ciudad de M+//0A7f/9AKk-xico,+ACI-http://maps.google.com/maps?q+AD0-loc:19.4423003,-99.1859615+ACI-,,,,,,,,,166,,,,,,Mariano Escobedo y lago Alberto,,,Muchas de las paredes del edifico est+//0A7f/9AOc-n cuarteadas por dentro y por fuera,,,,19.4423003,-99.1859615,
1500,1500,av gral Mariano Escobedo,,Miguel Hidalgo,ciudad de M+//0A7f/9AKk-xico,,,,,,,,,,151 pb pisos 1 2 y 3,,,,,,,,,Se abrieron grietas en el edificio de fantas+//0A7QBf-as Miguel  se cayeron tabiques  se levant+//0A7QBf- el piso y cay+//0A7QBf- tierra de las paredes,,,,,,
1501,1501,11 de April,,Miguel Hidalgo,Ciudad de M+//0A7f/9AKk-xico,+ACI-http://maps.google.com/maps?q+AD0-loc:19.3962136,-99.1840317+ACI-,,,,,,,,,200,,,,,,NA y NA,,Casa,Grietas en barda que da a la calle y en paredes de la casa.,,,,19.3962136,-99.1840317,
1502,1502,Mar Blanco,,Miguel Hidalgo,Ciudad de M+//0A7f/9AKk-xico,+ACI-http://maps.google.com/maps?q+AD0-loc:19.4543582,-99.1792967+ACI-,,,,,,,,,102 E,,,,,,Noche Triste y Mar Rojo,,,Algunas grietas en muros del ba+//0A7f/9ALE-o y comedor.,,,,19.4543582,-99.1792967,
1503,1503,Av.Ej+//0A7f/9AKk-rcito Nacional (Torre 2),,Miguel Hidalgo,Ciudad de M+//0A7f/9AKk-xico,+ACI-http://maps.google.com/maps?q+AD0-loc:19.4367558,-99.1793111+ACI-,,,,,,,,,225,,,,,,Rincon del rio y Rincon del amor,,Departamentos,+ACI-Grietas en muros divisorios, desprendimiento de acabados, grietas en aplanados a altura de trabes en cubos de escaleras+ACI-,,,,19.4367558,-99.1793111,
1504,1504,Moliere y Av ej+//0A7f/9AKk-rcito nacional frente a Antara es la UPN 094,,Miguel hidalgo,Ciudad de M+//0A7f/9AKk-xico,,,,,,,,,,5579075758,,,,,,R+//0A7QBf-o Sena y R+//0A7QBf-o Rhin,,Comercio,M+//0A7QBf-ltiples afectaciones en el sexto piso grietas muy grandes,,,,,,
1505,1505,Mar Tirreno,,Miguel Hidalgo,Ciudad de M+//0A7f/9AKk-xico,+ACI-http://maps.google.com/maps?q+AD0-loc:19.4579188,-99.1829774+ACI-,,,,,,,,,125,,,,,,roma y NA,,Oficinas,+ACI-La casa tiene grietas muy pronunciadas, las escaleras se compactaron y en la fachada se puede ver cascajo de las grietas que se hicieron. Ventanas rotas.+ACI-,,,,19.4579188,-99.1829774,
1506,1506,Golfo de Guayaquil,,Miguel Hidalgo,Ciudad de M+//0A7f/9AKk-xico,+ACI-http://maps.google.com/maps?q+AD0-loc:19.4561378,-99.1901541+ACI-,,,,,,,,,82,,,,,,Sevilla y Praga,,Departamentos,Grietas en estructuras centrales del edificio as+//0A7QBf- como separaci+//0A7QBf-n de una barda.,,,,19.4561378,-99.1901541,
1507,1507,Lago Cuitzeo,,Miguel Hidalgo,Ciudad de M+//0A7f/9AKk-xico,+ACI-http://maps.google.com/maps?q+AD0-loc:19.4477958,-99.1735467+ACI-,,,,,,,,,32,,,,,,Torres Adalid y Luz Savignon,,Departamentos,Grietas en todas las trabes de estacionamiento (planta baja) localizadas a 1/4 de izquierda a derecha y a 1/4 de derecha a izquierda y a su vez en el centro de la trabe y en dos columnas principales una grieta horizontal en cada una.,,,,19.4477958,-99.1735467,
1508,1508,Presa Salinillas,,Miguel Hidalgo,Col. Irrigaci+//0A7QBf-n c.p. 11500,+ACI-http://maps.google.com/maps?q+AD0-loc:19.4442789,-99.2153684+ACI-,,,,,,,,,370,,,,,,Presa Valsequillo e ingenieros militares,,,Edificio de oficinas de 10 pisos m+//0A7f/9AOc-s 2 niveles de estacionamiento subterr+//0A7f/9AOc-neo.  Hay grietas  pisos quebrados . Dentro de cada oficina hubo diversos da+//0A7f/9ALE-os... Se ve fuerte pero es mejor que por la cantidad de gente que acude a laborar ser+//0A7QBf-a buena inspecci+//0A7QBf-n de protecci+//0A7QBf-n civil.  Hay m+//0A7f/9AOc-s de 100 empresas y al rededor de 3mil personas.  Por favor.,,,,19.4442789,-99.2153684,
1509,1509,Cerrada de Lago Onega,,Miguel Hidalgo,Mexico,+ACI-http://maps.google.com/maps?q+AD0-loc:19.4496306,-99.1885661+ACI-,,,,,,,,,102,,,,,,Lago Wam y Lago Trasimeno,,,Grietas en el edificio,,,,19.4496306,-99.1885661,
1510,1510,EJERCITO NACIONAL,,MIGUEL HIDALGO,MEXICO,+ACI-http://maps.google.com/maps?q+AD0-loc:19.4374987,-99.1861418+ACI-,,,,,,,,,104,,,,,,SHAKESPEARE Y BECQUER,,,EL CONDOMINIO PRESENTA IMPORTANTES GRIETAS,,,,19.4374987,-99.1861418,
1511,1511,Masaryk,,Miguel Hidalgo,M+//0A7f/9AKk-xico,+ACI-http://maps.google.com/maps?q+AD0-loc:19.4319472,-99.1860116+ACI-,,,,,,,,,111,,,,,,Schiller y petrarca,,,Hay puertas caidas y grietas,,,,19.4319472,-99.1860116,
1512,1512,Emerson,,Miguel Hidalgo,M+//0A7f/9AKk-xico D.F.  Polanco,+ACI-http://maps.google.com/maps?q+AD0-loc:19.4365558,-99.1887021+ACI-,,,,,,,,,136,,,,,,Eje 6 y Calle 12,,Casa,Se ampli+//0A7QBf- la Separaci+//0A7QBf-n con respecto al edificio colindante,,,,19.4365558,-99.1887021,
1513,1513,Progreso,,Miguel Hidalgo,Mexico DF,+ACI-http://maps.google.com/maps?q+AD0-loc:19.2846865,-99.1886134+ACI-,,,,,,,,,218,,,,,,Juan Manuel Torrea y Federico Montes,,Departamentos,Muchas grietas,,,,19.2846865,-99.1886134,
1514,1514,Shakespeare,,Miguel Hidalgo,,+ACI-http://maps.google.com/maps?q+AD0-loc:19.4273801,-99.1764974+ACI-,,,,,,,,,39,,,,,,111a oriente y 113a oriente,,Departamentos,Cuarteaduras y muchas grietas,,,,19.4273801,-99.1764974,
1515,1515,Melchor Ocampo,,Miguel Hidalgo,,+ACI-http://maps.google.com/maps?q+AD0-loc:19.4331715,-99.1721354+ACI-,,,,,,,,,275,,,,,,Actipan y Algeciras,,Oficinas,,,,,19.4331715,-99.1721354,
1516,1516,Hegel,,Miguel hidalgo,,+ACI-http://maps.google.com/maps?q+AD0-loc:19.4366475,-99.1879712+ACI-,,,,,,,,,129,,,,,,Amores y Av coyoacan,,Departamentos,Grietas,,,,19.4366475,-99.1879712,
1517,1517,Gutemberg,,Miguel hidalgo,,+ACI-http://maps.google.com/maps?q+AD0-loc:19.433517,-99.1731067+ACI-,,,,,,,,,53,,,,,,Amsterdam y Nuevo Le+//0A7QBf-n,,Departamentos,Grietas en la +//0A7QBf-ltima losa (azotea) y la ca+//0A7QBf-da de un pedazo de muro en los cuartos de la azotea,,,,19.433517,-99.1731067,
1518,1518,Horacio,,Miguel Hidalgo,,+ACI-http://maps.google.com/maps?q+AD0-loc:19.4352951,-99.2076983+ACI-,,,,,,,,,1608,,,,,,Arcos de bel+//0A7f/9AKk-n y R+//0A7QBf-o de la loza,,Departamentos,Paredes agrietadas,,,,19.4352951,-99.2076983,
1519,1519,Bah+//0A7QBf-a de santa barbara,,MIGUEL HIDALGO,,+ACI-http://maps.google.com/maps?q+AD0-loc:19.4381694,-99.1771833+ACI-,,,,,,,,,20,,,,,,Arquitectura y Odontolog+//0A7QBf-a,,Departamentos,GRIETAS MUCHAS,,,,19.4381694,-99.1771833,
1520,1520,calzada mex tacuba,,Miguel hidalgo,,+ACI-http://maps.google.com/maps?q+AD0-loc:19.4555964,-99.2112804+ACI-,,,,,,,,,1501,,,,,,bruno traben y carrillo puerto,,Departamentos,Grietas en la pared pegada al techo,,,,19.4555964,-99.2112804,
1521,1521,Descartes,,Miguel Hidalgo,,+ACI-http://maps.google.com/maps?q+AD0-loc:19.4287887,-99.1765482+ACI-,,,,,,,,,62,,,,,,C+//0A7f/9AOc-diz Sur y Malaga,,Departamentos,+ACI-Da+//0A7f/9ALE-os en techos, paredes, tuberias, escaleras+ACI-,,,,19.4287887,-99.1765482,
1522,1522,Descartes,,Miguel Hidalgo,,+ACI-http://maps.google.com/maps?q+AD0-loc:19.4285168,-99.1764854+ACI-,,,,,,,,,48,,,,,,C+//0A7f/9AOc-diz y Santander,,Departamentos,Grietas en paredes. Escalera separada de la pared.,,,,19.4285168,-99.1764854,
1523,1523,Hegel,,Miguel hidalgo,,+ACI-http://maps.google.com/maps?q+AD0-loc:19.4291833,-99.1879205+ACI-,,,,,,,,,610,,,,,,Calle 18 y Toltecas,,Departamentos,Grietas en el concreto de soporte del garaje del edifico y en las paredes de los departamentos,,,,19.4291833,-99.1879205,
1524,1524,Bahia de Perula 102 entra Bahia De Santa Barbara y Marina Nacional,,Miguel Hidalgo,,,,,,,,,,,5517299686,,,,,,Calle ma+//0A7f/9ALE-anitas y Rancho grande,,Casa,Se cayo la mitad de la casa,,,,,,
1525,1525,Descartes,,Miguel Hidalgo,,+ACI-http://maps.google.com/maps?q+AD0-loc:19.4285168,-99.1764854+ACI-,,,,,,,,,48,,,,,,Casi esquina Churubusco y NA,,Oficinas,Grietas en paredes. Escalera separada de la pared.,,,,19.4285168,-99.1764854,
1526,1526,Golfo de Gabes,,Miguel Hidalgo,,+ACI-http://maps.google.com/maps?q+AD0-loc:19.455423,-99.18644+ACI-,,,,,,,,,51,,,,,,Eje 5 y Concepci+//0A7QBf-n Beistegui,,Departamentos,Muy mal no nos dejan habitar lo por seguridad tenemos miedo que se derrumbe totalmente ay+//0A7QBf-denos por favor es nuestro patrimonio gracias,,,,19.455423,-99.18644,
1527,1527,Paseo de la Reforma,,Miguel Hidalgo,,+ACI-http://maps.google.com/maps?q+AD0-loc:19.4034118,-99.230802+ACI-,,,,,,,,,2233,,,,,,Ferrocarril de Cuernavaca y Juan V+//0A7f/9AOc-zquez de mella,,Departamentos,Cuarteaduras en la pared,,,,19.4034118,-99.230802,
1528,1528,Descartes,,Miguel Hidalgo,,+ACI-http://maps.google.com/maps?q+AD0-loc:19.4285168,-99.1764854+ACI-,,,,,,,,,48,,,,,,F+//0A7QBf-sicos y Farmac+//0A7f/9AKk-uticos,,Casa,Paredes destrazadas posibles fracturas de estructura urge revisar,,,,19.4285168,-99.1764854,
1529,1529,Dickens,,Miguel Hidalgo,,+ACI-http://maps.google.com/maps?q+AD0-loc:19.4301302,-99.2027556+ACI-,,,,,,,,,52,,,,,,Gonz+//0A7f/9AOc-lez Herrejon y Molino de Rosas,,Departamentos,Algunas paredes presentan cuarteaduras,,,,19.4301302,-99.2027556,
1530,1530,Mutualismo,,Miguel Hidalgo,,+ACI-http://maps.google.com/maps?q+AD0-loc:19.4012278,-99.1727798+ACI-,,,,,,,,,79,,,,,,Madero y 42994,,Comercio,+ACI-Una columna presenta grietas, y gran parte del edificio tambi+//0A7f/9AKk-n, partes del techo est+//0A7f/9AOc-n ca+//0A7QBf-das, urge protecci+//0A7QBf-n civil en el inmueble.+ACI-,,,,19.4012278,-99.1727798,
1531,1531,Calzada mexico tacuba,,Miguel hidalgo,,+ACI-http://maps.google.com/maps?q+AD0-loc:19.4508267,-99.1727237+ACI-,,,,,,,,,271,,,,,,Mariano Arista y Lerdo de tejada,,Departamentos,Muchas cuarteaduras y partes dumbadas y un boquete y recargado un poco otro edificio contiguo,,,,19.4508267,-99.1727237,
1532,1532,Av. Palmas,,Miguel Hidalgo,,+ACI-http://maps.google.com/maps?q+AD0-loc:19.4284849,-99.217574+ACI-,,,,,,,,,805,,,,,,Monte tabor y Cierra mojada,,Oficinas,Hay varias cuarteaduras. Dos de ellas parecen importantes.,,,,19.4284849,-99.217574,
1533,1533,Rinconada de Lago Superior,,Miguel Hidalgo,,+ACI-http://maps.google.com/maps?q+AD0-loc:19.4559625,-99.1925131+ACI-,,,,,,,,,46,,,,,,Morelos y Circuito Pedro Anaya,,Casa,Grietas en departamentos y fachada de edificio,,,,19.4559625,-99.1925131,
1534,1534,Lago Nechatel,,Miguel Hidalgo,,+ACI-http://maps.google.com/maps?q+AD0-loc:19.442735,-99.2011113+ACI-,,,,,,,,,45  interios 204 C,,,,,,,,,Se cuartearon las paredes del departamento en diagonal y horizontal. Se rompieron pedazos de las paredes. La administraci+//0A7QBf-n dice que no hubo afectaciones mayores pero en mi departamento se ve que se da+//0A7f/9ALH//QDtAF8- la estructura. Dorm+//0A7QBf- fuera pero dejo mi cel para ir a abrirles. 5559678642,,,,19.442735,-99.2011113,
1535,1535,Mexico-Tacuba,,Miguel Hidalgo,,+ACI-http://maps.google.com/maps?q+AD0-loc:19.4559439,-99.2118024+ACI-,,,,,,,,,1523,,,,,,NA y Enrico martinez y balderas,,Departamentos,Grieta en Ventana,,,,19.4559439,-99.2118024,
1536,1536,Homero,,Miguel hidalgo,,+ACI-http://maps.google.com/maps?q+AD0-loc:19.4306575,-99.2083953+ACI-,,,,,,,,,,,,,,,NA y NA,,Oficinas,Ca+//0A7QBf-da de fachada,,,,19.4306575,-99.2083953,
1537,1537,Palmas,,Miguel Hidalgo,,+ACI-http://maps.google.com/maps?q+AD0-loc:19.3123494,-99.2485199+ACI-,,,,,,,,,,,,,,,NA y NA,,Departamentos,Varias grietas,,,,19.3123494,-99.2485199,
1538,1538,Sanctorum,,Miguel Hidalgo,,+ACI-http://maps.google.com/maps?q+AD0-loc:19.4578141,-99.2073581+ACI-,,,,,,,,,41,,,,,,NA y NA,,Otro,,,,,19.4578141,-99.2073581,
1539,1539,Vicente Eguia,,Miguel hidalgo,,+ACI-http://maps.google.com/maps?q+AD0-loc:19.4079551,-99.1891262+ACI-,,,,,,,,,72,,,,,,Nicolas San Juan y Heriberto Frias,,Departamentos,Barandal a punto de caer,,,,19.4079551,-99.1891262,
1540,1540,Ejercito nacional,,Miguel hidalgo,,+ACI-http://maps.google.com/maps?q+AD0-loc:19.4357731,-99.1793296+ACI-,,,,,,,,,216,,,,,,Oaxaca y Monterrey,,Departamentos,Estructural,,,,19.4357731,-99.1793296,
1541,1541,2da cda lago muritz  col. Anahua,,Miguel hidalgo,,,,,,,,,,,15,,,,,,Obrero mundial y Caleta,,Departamentos,La casa de repente como que truena. Es de 2 pisos,,,,,,
1542,1542,Ejercito nacional,,Miguel Hidalgo,,+ACI-http://maps.google.com/maps?q+AD0-loc:19.4326197,-99.1728572+ACI-,,,,,,,,,17,,,,,,Oriente 3 y Oriente 4,,Oficinas,Se hicieron grietas en dos paredes diferentes de mi departamento,,,,19.4326197,-99.1728572,
1543,1543,Lago Cuitzeo,,Miguel Hidalgo,,+ACI-http://maps.google.com/maps?q+AD0-loc:19.4477958,-99.1735467+ACI-,,,,,,,,,32,,,,,,Patricio Sanz y San Francisco,,Departamentos,grietas,,,,19.4477958,-99.1735467,
1544,1544,Hegel,,Miguel Hidalgo,,+ACI-http://maps.google.com/maps?q+AD0-loc:19.4362638,-99.1879737+ACI-,,,,,,,,,141,,,,,,Peruanos y Argentinos,,Casa,Grietas y cristales rotos,,,,19.4362638,-99.1879737,
1545,1545,Poniente 139-a,,Miguel hidalgo,,+ACI-http://maps.google.com/maps?q+AD0-loc:19.4516397,-99.2028514+ACI-,,,,,,,,,721,,,,,,Plan de san luis y NA,,Departamentos,+ACI-Poste de luz ubicado afuera del +ACM-721 de la calle poniente presenta grietas , es alarmante por qu+//0A7f/9AKk- tiene muchos cables de alumbrado p+//0A7QBf-blico y de energ+//0A7QBf-a y servicios de cable e internet+ACI-,,,,19.4516397,-99.2028514,
1546,1546,Av Marina Nacional 200,,Miguel Hidalgo,,+ACI-http://maps.google.com/maps?q+AD0-loc:19.4401735,-99.1755474+ACI-,,,,,,,,,64,,,,,,Rafael de la pe+//0A7f/9ALE-a y Av. Aldama,,Casa,+ACI-Muros, grietas+ACI-,,,,19.4401735,-99.1755474,
1547,1547,tordo,,Miguel Hidalgo,,+ACI-http://maps.google.com/maps?q+AD0-loc:19.4003205,-99.1896413+ACI-,,,,,,,,,21,,,,,,Reforma y Y eje central,,Departamentos,Grietas grandes,,,,19.4003205,-99.1896413,
1548,1548,Lago Hielmar,,Miguel Hidalgo,,+ACI-http://maps.google.com/maps?q+AD0-loc:19.4432042,-99.1921971+ACI-,,,,,,,,,103,,,,,,Torres Adalid y Luz Savi+//0A7f/9ALH//QDtAF8-n,,Departamentos,Grietas en los balcones,,,,19.4432042,-99.1921971,
1549,1549,Golfo de Gabes,,Miguel Hidalgo,,+ACI-http://maps.google.com/maps?q+AD0-loc:19.455423,-99.18644+ACI-,,,,,,,,,51,,,,,,Vazco de quiroga y Paseo de tabachines,,Oficinas,Muy mal no nos dejan habitar lo por seguridad tenemos miedo que se derrumbe totalmente ay+//0A7QBf-denos por favor es nuestro patrimonio gracias,,,,19.455423,-99.18644,
1550,1550,Homero 1532,,Miguel hidalgo,Polanco,+ACI-http://maps.google.com/maps?q+AD0-loc:19.4361483,-99.2059692+ACI-,,,,,,,,,,,,,,,igualdad y tizapan,,Otro,Hay grietas en 4 pisos en el mismo lugar,,,,19.4361483,-99.2059692,
1551,1551,Petrarca,,Miguel hidalgo,+ACI-Polanco V secci+//0A7QBf-n, Miguel hidalgo 11570+ACI-,+ACI-http://maps.google.com/maps?q+AD0-loc:19.4335812,-99.18561+ACI-,,,,,,,,,253,,,,,,Antigua calzada de Guadalupe y Callejon de la era,,Departamentos,Ninguno,,,,19.4335812,-99.18561,
1552,1552,Adalberto Tejeda,,Minatitl+//0A7f/9AOc-n,Minatitl+//0A7f/9AOc-n,+ACI-http://maps.google.com/maps?q+AD0-loc:18.0130951,-94.5546468+ACI-,,,,,,,,,64,,,,,,Quintana Roo y Tehuantepec,,Departamentos,Se cay+//0A7QBf- una chimenea de mi patio,,,,18.0130951,-94.5546468,
1553,1553,Ajusco,,Morelos,Cuernavaca,+ACI-http://maps.google.com/maps?q+AD0-loc:19.5277612,-99.0339467+ACI-,,,,,,,,,33,,,,,,Laurel y Cerritos,,,Grietas a lo largo de 3 paredes,,,,19.5277612,-99.0339467,
1554,1554,Alicia esquina reforma,,Morelos,Xochitepec,+ACI-http://maps.google.com/maps?q+AD0-loc:19.334386,-99.20476+ACI-,,,,,,,,,S/n,,,,,,Frente a la iglesia,,,Toda la barda frontal y port+//0A7QBf-n se cay+//0A7QBf-,,,,19.334386,-99.20476,
1555,1555,Pedro saavedra,,Morelos,Zacatepec,+ACI-http://maps.google.com/maps?q+AD0-loc:19.3866197,-99.0568982+ACI-,,,,,,,,,3b,,,,,,Gildardo maga+//0A7f/9ALE-a,,,5 paredes agrietadas en diagonal.,,,,19.3866197,-99.0568982,
1556,1556,Filiberto Nava n+//0A7QBf-mero 7,,Municipio Almoloya del r+//0A7QBf-o,Estado de M+//0A7f/9AKk-xico,+ACI-http://maps.google.com/maps?q+AD0-loc:19.1639889,-99.4870577+ACI-,,,,,,,,,N+//0A7QBf-mero 7,,,,,,Anselmo Camacho y Carlos Hank Gonzalez,,,Inclinaci+//0A7QBf-n de un poste de luz,,,,19.1639889,-99.4870577,
1557,1557,Ju+//0A7f/9AOc-rez,,Municipio de Nezahualc+//0A7QBf-yotl,,+ACI-http://maps.google.com/maps?q+AD0-loc:19.3923111,-99.0146505+ACI-,,,,,,,,,273,,,,,,Monte Tabor y Cerro Mayka,,Departamentos,Abertura en paredes y desprendimiento de una parte peque+//0A7f/9ALE-a del techo o loza,,,,19.3923111,-99.0146505,
1558,1558,Miguel hidalgo,,Municipio de tlapehuala,+ACI-Morelita, edo. de Guerrero+ACI-,,,,,,,,,,21,,,,,,danubio y tigris,,Departamentos,En riesgo de caerse la casa,,,,,,
1559,1559,Miguel hidalgo,,Municipio de tlapehuala,+ACI-Morelita, edo. de Guerrero+ACI-,,,,,,,,,,21,,,,,,Rio Neva y Rio Amazonas,,Departamentos,En riesgo de caerse la casa,,,,,,
1560,1560,Calle Las Flores esq. Av. Zaragoza,,+ACI-Municipio La Paz, Pueblo San Sebastan chimalpa+ACI-,,+ACI-http://maps.google.com/maps?q+AD0-loc:19.3815261,-98.9531378+ACI-,,,,,,,,,,,,,,,+//0A7f/9AIE-lvaro Obreg+//0A7QBf-n  y Jos+//0A7f/9AKk- Mar+//0A7QBf-a de la Cueva y NA,,Casa,Se cayo una  torre de la parroquia de San Sebasti+//0A7f/9AOc-n Mattir y sufrio serias grietas en la c+//0A7QBf-pula y paredes,,,,19.3815261,-98.9531378,
1561,1561,Av la Colmena,,+ACI-Municipio Nicolas Romero, Edo Mex+ACI-,Nicolas Romero,,,,,,,,,,402,,,,,,Nuevo Le+//0A7QBf-n y Campeche,,Departamentos,Grietas pequenas en techo y piso,,,,,,
1562,1562,av ejidos,,municipio Tlalnepantla de Baz,estado de M+//0A7f/9AKk-xico,+ACI-http://maps.google.com/maps?q+AD0-loc:19.4926964,-99.1448972+ACI-,,,,,,,,,31,,,,,,encino e indeco  en reyes Ixtacala,,,Se ve separada la uni+//0A7QBf-n de una de las rec+//0A7f/9AOc-maras como agrietada.,,,,19.4926964,-99.1448972,
1563,1563,Calzada arboleda,,Municipio tlanepantla,,+ACI-http://maps.google.com/maps?q+AD0-loc:19.5328783,-99.1633993+ACI-,,,,,,,,,40,,,,,,Entre 21 Sur y Y 23 Sur,,Casa,,,,,19.5328783,-99.1633993,
1564,1564,avenida Predos,,municipio tultitlan,estado de mexico,+ACI-http://maps.google.com/maps?q+AD0-loc:19.6455991,-99.1688385+ACI-,,,,,,,,,107,,,,,,bugambilias y crisantemos,,,el interios de algunos departamentos presentan grietas y en la parte de afuera tambien. no se alcanza a ver todo el edificio pues es de 5 pisos. los pasillos tambien presentan grietas en los descansos de la escaleras.  Por favor ayudenos con la revision  pues cuando ocurrio el sismo pasado  nadie vino a revisar.,,,,19.6455991,-99.1688385,
1565,1565,Oriente 22 4a Cerrada,,Municipio Valle de Chalco Solidaridad,Estado de M+//0A7f/9AKk-xico,,,,,,,,,,MZ 496 LOTE 60,,,,,,Av. L+//0A7QBf-pez Mateos y Norte 10 es una reja con jard+//0A7QBf-n,,otro,Grietas grandes en muro de cocina y barda. Grietas m+//0A7f/9AOc-s chicas en ba+//0A7f/9ALE-o y cuartos,,,,,,
1566,1566,Ni+//0A7f/9ALE-os heroes,,,Acamilpa,+ACI-http://maps.google.com/maps?q+AD0-loc:19.3864947,-99.1435398+ACI-,,,,,,,,,,,,,,,Naranjo y Cipres,,Departamentos,+ACI-Muy grave, secciones completas derribadas+ACI-,,,,19.3864947,-99.1435398,
1567,1567,Amberes,,,CD.MX.,+ACI-http://maps.google.com/maps?q+AD0-loc:19.4239396,-99.1642203+ACI-,,,,,,,,,78,,,,,,,,Hotel royal reforma,Se presentan grietas en varias partes del hotel,,,,19.4239396,-99.1642203,
1568,1568,laredo y amsterdam,,,cdmx,+ACI-http://maps.google.com/maps?q+AD0-loc:19.4128991,-99.1708787+ACI-,,,,,,,,,,,,,,,,,,,,,,19.4128991,-99.1708787,
1569,1569,,,,CDMX,+ACI-http://maps.google.com/maps?q+AD0-loc:19.4326077,-99.133208+ACI-,,,,,,,,,,,,,,,,,,Edificio de Fox Sports a un lado del Hotel Royal Pedregal,,,,19.4326077,-99.133208,
1570,1570,Revillagigedo,,,CDMX  centro,+ACI-http://maps.google.com/maps?q+AD0-loc:19.4331844,-99.1463715+ACI-,,,,,,,,,23,,,,,,,,,Primer y segundo piso paredes agrietadas  caida y reventaduras de azulejos  letrero del frente se aprecia falseado,,,,19.4331844,-99.1463715,
1571,1571,Calle camino A la Hacienda,,,Chicoloapan de Ju+//0A7f/9AOc-rez,+ACI-http://maps.google.com/maps?q+AD0-loc:19.3457515,-99.1236887+ACI-,,,,,,,,,5520802191,,,,,,20 y 24,,Casa,Solo son algunas grietas en varias partes de la casa,,,,19.3457515,-99.1236887,
1572,1572,Vicente guerrero,,,Chietla  puebla,+ACI-http://maps.google.com/maps?q+AD0-loc:19.3526608,-99.1650325+ACI-,,,,,,,,,27,,,,,,Dolores y allende,,,A un cuarto se le cayo el techo  y se tendr+//0A7f/9AOc- que tirar pared a otros dos ya que podr+//0A7QBf-an caer en alg+//0A7QBf-n momento y es peligroso para la personas que transitan por mi calle como para nosotros dentro de la casa,,,,19.3526608,-99.1650325,
1573,1573,19 Poniente,,,+ACI-Cholula, Puebla+ACI-,+ACI-http://maps.google.com/maps?q+AD0-loc:19.3819388,-98.9907314+ACI-,,,,,,,,,306,,,,,,101 y congreso de la Union y Oriente 95 y 101,,Departamentos,Grietas importantes en la parte baja de la casa,,,,19.3819388,-98.9907314,
1574,1574,,,,Ciudad de M+//0A7f/9AKk-xico,+ACI-http://maps.google.com/maps?q+AD0-loc:19.4326077,-99.133208+ACI-,,,,,,,,,,,,,,,,,,,,,,19.4326077,-99.133208,
